Pathway,n_genes,p_val,mean_score,median_score,stat,FDR
Monoatomic Cation Transmembrane Transport (GO:0098655),281,0.5920172816946614,-0.002324907472881969,-0.0149384794213524,2689376.0,0.8878318219820439
Cellular Response To Organonitrogen Compound (GO:0071417),104,0.5939458813224309,0.03800823821836912,-0.0149384794213524,1003506.0,0.8878318219820439
Positive Regulation Of Vasculature Development (GO:1904018),104,0.5949775945831575,-0.006132670923035434,-0.0149384794213524,1003477.0,0.8878318219820439
Positive Regulation Of Kinase Activity (GO:0033674),103,0.5961227772436481,-0.014936785455984395,-0.0149384794213524,993835.0,0.8878318219820439
Inorganic Cation Transmembrane Transport (GO:0098662),284,0.5992951441729741,-0.0024581494300841204,-0.0149384794213524,2717348.0,0.8878318219820439
Golgi Vesicle Transport (GO:0048193),197,0.6023537460873626,0.020685002717730716,-0.0149384794213524,1892736.0,0.8878318219820439
Positive Regulation Of Metabolic Process (GO:0009893),106,0.6053731023515367,-0.014771719723885841,-0.0149384794213524,1022398.0,0.8878318219820439
Response To Calcium Ion (GO:0051592),106,0.605443080376236,-0.014794074920996504,-0.0149384794213524,1022396.0,0.8878318219820439
DNA-templated Transcription (GO:0006351),198,0.6088135050251581,-0.013758285116177346,-0.0149384794213524,1902003.0,0.8878318219820439
Positive Regulation Of Protein Phosphorylation (GO:0001934),376,0.6122256995501296,-0.00984202883327022,-0.0149384794213524,3580422.0,0.8878318219820439
Regulation Of MAPK Cascade (GO:0043408),199,0.6136099474400056,-0.014423486300279604,-0.0149384794213524,1911332.0,0.8878318219820439
Regulation Of Proteasomal Ubiquitin-Dependent Protein Catabolic Process (GO:0032434),109,0.6139533045405713,-0.010617588782884843,-0.0149384794213524,1050963.0,0.8878318219820439
Protein Deubiquitination (GO:0016579),109,0.614330479081606,-0.012170058684086492,-0.0149384794213524,1050952.0,0.8878318219820439
Regulation Of Translation (GO:0006417),201,0.6155951623475927,-0.008665717817472057,-0.0149384794213524,1930284.0,0.8878318219820439
Cellular Response To Salt (GO:1902075),109,0.6163516534343398,-0.014798049356786113,-0.0149384794213524,1050893.0,0.8878318219820439
Negative Regulation Of Programmed Cell Death (GO:0043069),379,0.6164768595415269,0.0023730536727542546,-0.0149384794213524,3608215.0,0.8878318219820439
Protein Stabilization (GO:0050821),202,0.6166433920308596,0.013929727272136561,-0.0149384794213524,1939756.0,0.8878318219820439
Negative Regulation Of Apoptotic Process (GO:0043066),467,0.6173002905589222,0.0010719598216698415,-0.0149384794213524,4426172.0,0.8878318219820439
Response To Lipid (GO:0033993),110,0.6181726522028261,-0.012923407335049429,-0.0149384794213524,1060441.0,0.8878318219820439
Regulation Of Transforming Growth Factor Beta Receptor Signaling Pathway (GO:0017015),111,0.6198417601201316,0.016976664625408467,-0.0149384794213524,1069992.0,0.8878318219820439
Negative Regulation Of Transmembrane Receptor Protein Serine/Threonine Kinase Signaling Pathway (GO:0090101),111,0.6198417601201316,0.016976664625408467,-0.0149384794213524,1069992.0,0.8878318219820439
Mitotic Sister Chromatid Segregation (GO:0000070),111,0.6219036358698988,-0.013237285659644724,-0.0149384794213524,1069931.0,0.8878318219820439
Cytoskeleton Organization (GO:0007010),111,0.62214002388922,-0.013763218128255863,-0.0149384794213524,1069924.0,0.8878318219820439
Negative Regulation Of Defense Response (GO:0031348),112,0.6238818287023926,-0.004845880503082454,-0.0149384794213524,1079471.0,0.8878318219820439
Negative Regulation Of Canonical Wnt Signaling Pathway (GO:0090090),111,0.6240969006458125,-0.014897631129956315,-0.0149384794213524,1069866.0,0.8878318219820439
Positive Regulation Of Cellular Component Organization (GO:0051130),112,0.6259612316408534,-0.014244686223939266,-0.0149384794213524,1079409.0,0.8878318219820439
Regulation Of Intracellular Signal Transduction (GO:1902531),296,0.6313949137509441,-0.013001112155519804,-0.0149384794213524,2828950.0,0.8878318219820439
Endoplasmic Reticulum To Golgi Vesicle-Mediated Transport (GO:0006888),115,0.6337882168652794,0.00700722229392488,-0.0149384794213524,1107961.0,0.8878318219820439
Cellular Response To Molecule Of Bacterial Origin (GO:0071219),116,0.6386049586500582,-0.012490174239554988,-0.0149384794213524,1117407.0,0.8878318219820439
Protein Maturation (GO:0051604),116,0.6396463202906496,-0.014335829549204452,-0.0149384794213524,1117375.0,0.8878318219820439
Positive Regulation Of Cell Cycle Process (GO:0090068),117,0.6410676445474341,-0.007986861518623352,-0.0149384794213524,1126923.0,0.8878318219820439
Regulation Of GTPase Activity (GO:0043087),210,0.6434510896634162,-0.01488040984714324,-0.0149384794213524,2014732.0,0.8878318219820439
Regulation Of Execution Phase Of Apoptosis (GO:1900117),11,0.6443600998929325,-0.0149384794213524,-0.0149384794213524,105611.0,0.8878318219820439
Positive Regulation Of Cell Projection Organization (GO:0031346),118,0.6474825030415315,-0.01488094604462164,-0.0149384794213524,1136314.0,0.8878318219820439
Positive Regulation Of Angiogenesis (GO:0045766),119,0.647515679688579,-0.0072426467841678254,-0.0149384794213524,1145902.0,0.8878318219820439
Renal Filtration (GO:0097205),12,0.6504716155913882,-0.0149384794213524,-0.0149384794213524,115206.0,0.8878318219820439
Regulation Of Protein Catabolic Process (GO:0042176),121,0.652914776812592,0.0358164929307817,-0.0149384794213524,1164906.0,0.8878318219820439
Intraciliary Anterograde Transport (GO:0035720),13,0.6562975852187739,-0.0149384794213524,-0.0149384794213524,124800.0,0.8878318219820439
Alpha-Beta T Cell Activation (GO:0046631),13,0.6562975852187739,-0.0149384794213524,-0.0149384794213524,124800.0,0.8878318219820439
Fatty Acid Metabolic Process (GO:0006631),121,0.6563654052580076,-0.014774206564970497,-0.0149384794213524,1164796.0,0.8878318219820439
Positive Regulation Of Defense Response (GO:0031349),123,0.6601252629440169,-0.007492917764238868,-0.0149384794213524,1183844.0,0.8878318219820439
Vesicle-Mediated Transport (GO:0016192),402,0.660369693548033,0.00964608847584863,-0.0149384794213524,3820260.0,0.8878318219820439
Cellular Response To Lipopolysaccharide (GO:0071222),123,0.6609908052785161,-0.012629508680795492,-0.0149384794213524,1183816.0,0.8878318219820439
Protein Dephosphorylation (GO:0006470),123,0.6616394051095812,-0.013951610495583707,-0.0149384794213524,1183795.0,0.8878318219820439
Regulation Of Interleukin-13 Production (GO:0032656),14,0.6618692251551144,-0.0149384794213524,-0.0149384794213524,134393.0,0.8878318219820439
Stem Cell Development (GO:0048864),14,0.6618692251551144,-0.0149384794213524,-0.0149384794213524,134393.0,0.8878318219820439
Ganglioside Biosynthetic Process (GO:0001574),14,0.6618692251551144,-0.0149384794213524,-0.0149384794213524,134393.0,0.8878318219820439
Negative Regulation Of Gluconeogenesis (GO:0045721),14,0.6618692251551144,-0.0149384794213524,-0.0149384794213524,134393.0,0.8878318219820439
Membrane Repolarization During Action Potential (GO:0086011),14,0.6618692251551144,-0.0149384794213524,-0.0149384794213524,134393.0,0.8878318219820439
Cellular Response To Zinc Ion (GO:0071294),14,0.6618692251551144,-0.0149384794213524,-0.0149384794213524,134393.0,0.8878318219820439
Dolichol-Linked Oligosaccharide Biosynthetic Process (GO:0006488),14,0.6618692251551144,-0.0149384794213524,-0.0149384794213524,134393.0,0.8878318219820439
Positive Regulation Of Cell Activation (GO:0050867),14,0.6618692251551144,-0.0149384794213524,-0.0149384794213524,134393.0,0.8878318219820439
Positive Regulation Of Intracellular Protein Transport (GO:0090316),124,0.6622416494481469,0.03458855005129459,-0.0149384794213524,1193358.0,0.8878318219820439
Regulation Of Mitotic Cell Cycle (GO:0007346),124,0.6627331781812091,0.005264709243253957,-0.0149384794213524,1193342.0,0.8878318219820439
Neuron Projection Guidance (GO:0097485),124,0.6653397523203752,-0.014650455708447625,-0.0149384794213524,1193257.0,0.8878318219820439
Ceramide Catabolic Process (GO:0046514),15,0.6672123267326436,-0.0149384794213524,-0.0149384794213524,143985.0,0.8878318219820439
Histone H4-K8 Acetylation (GO:0043982),15,0.6672123267326436,-0.0149384794213524,-0.0149384794213524,143985.0,0.8878318219820439
Positive Regulation Of Transmembrane Transport (GO:0034764),15,0.6672123267326436,-0.0149384794213524,-0.0149384794213524,143985.0,0.8878318219820439
Positive Regulation Of Secretion (GO:0051047),15,0.6672123267326436,-0.0149384794213524,-0.0149384794213524,143985.0,0.8878318219820439
Glycosaminoglycan Catabolic Process (GO:0006027),15,0.6672123267326436,-0.0149384794213524,-0.0149384794213524,143985.0,0.8878318219820439
B Cell Mediated Immunity (GO:0019724),15,0.6672123267326436,-0.0149384794213524,-0.0149384794213524,143985.0,0.8878318219820439
Negative Regulation Of Phagocytosis (GO:0050765),15,0.6672123267326436,-0.0149384794213524,-0.0149384794213524,143985.0,0.8878318219820439
Negative Regulation Of Biosynthetic Process (GO:0009890),15,0.6672123267326436,-0.0149384794213524,-0.0149384794213524,143985.0,0.8878318219820439
Regulation Of Lipoprotein Lipase Activity (GO:0051004),15,0.6672123267326436,-0.0149384794213524,-0.0149384794213524,143985.0,0.8878318219820439
B Cell Activation Involved In Immune Response (GO:0002312),15,0.6672123267326436,-0.0149384794213524,-0.0149384794213524,143985.0,0.8878318219820439
DNA Double-Strand Break Processing (GO:0000729),15,0.6672123267326436,-0.0149384794213524,-0.0149384794213524,143985.0,0.8878318219820439
Endosome To Lysosome Transport Via Multivesicular Body Sorting Pathway (GO:0032510),15,0.6672123267326436,-0.0149384794213524,-0.0149384794213524,143985.0,0.8878318219820439
Regulation Of Granulocyte Macrophage Colony-Stimulating Factor Production (GO:0032645),15,0.6672123267326436,-0.0149384794213524,-0.0149384794213524,143985.0,0.8878318219820439
Negative Regulation Of Protein Processing (GO:0010955),15,0.6672123267326436,-0.0149384794213524,-0.0149384794213524,143985.0,0.8878318219820439
Transcription By RNA Polymerase I (GO:0006360),15,0.6672123267326436,-0.0149384794213524,-0.0149384794213524,143985.0,0.8878318219820439
Regulation Of Dephosphorylation (GO:0035303),15,0.6672123267326436,-0.0149384794213524,-0.0149384794213524,143985.0,0.8878318219820439
Regulation Of Cholesterol Biosynthetic Process (GO:0045540),15,0.6672123267326436,-0.0149384794213524,-0.0149384794213524,143985.0,0.8878318219820439
Regulation Of Cellular Response To Heat (GO:1900034),15,0.6672123267326436,-0.0149384794213524,-0.0149384794213524,143985.0,0.8878318219820439
Negative Regulation Of DNA Replication (GO:0008156),15,0.6672123267326436,-0.0149384794213524,-0.0149384794213524,143985.0,0.8878318219820439
Regulation Of Isotype Switching (GO:0045191),15,0.6672123267326436,-0.0149384794213524,-0.0149384794213524,143985.0,0.8878318219820439
Sympathetic Nervous System Development (GO:0048485),15,0.6672123267326436,-0.0149384794213524,-0.0149384794213524,143985.0,0.8878318219820439
Polyol Biosynthetic Process (GO:0046173),15,0.6672123267326436,-0.0149384794213524,-0.0149384794213524,143985.0,0.8878318219820439
Oogenesis (GO:0048477),15,0.6672123267326436,-0.0149384794213524,-0.0149384794213524,143985.0,0.8878318219820439
Regulation Of Clathrin-Dependent Endocytosis (GO:2000369),15,0.6672123267326436,-0.0149384794213524,-0.0149384794213524,143985.0,0.8878318219820439
Regulation Of mRNA Metabolic Process (GO:1903311),15,0.6672123267326436,-0.0149384794213524,-0.0149384794213524,143985.0,0.8878318219820439
Cardiac Myofibril Assembly (GO:0055003),15,0.6672123267326436,-0.0149384794213524,-0.0149384794213524,143985.0,0.8878318219820439
Regulation Of Interleukin-1 Production (GO:0032652),15,0.6672123267326436,-0.0149384794213524,-0.0149384794213524,143985.0,0.8878318219820439
Adenylate Cyclase-Activating Adrenergic Receptor Signaling Pathway (GO:0071880),15,0.6672123267326436,-0.0149384794213524,-0.0149384794213524,143985.0,0.8878318219820439
Activation Of NF-kappaB-inducing Kinase Activity (GO:0007250),15,0.6672123267326436,-0.0149384794213524,-0.0149384794213524,143985.0,0.8878318219820439
Cellular Response To Estrogen Stimulus (GO:0071391),15,0.6672123267326436,-0.0149384794213524,-0.0149384794213524,143985.0,0.8878318219820439
Presynapse Assembly (GO:0099054),15,0.6672123267326436,-0.0149384794213524,-0.0149384794213524,143985.0,0.8878318219820439
Protein Localization To Cell-Cell Junction (GO:0150105),15,0.6672123267326436,-0.0149384794213524,-0.0149384794213524,143985.0,0.8878318219820439
Positive Regulation Of Syncytium Formation By Plasma Membrane Fusion (GO:0060143),15,0.6672123267326436,-0.0149384794213524,-0.0149384794213524,143985.0,0.8878318219820439
Regulation Of Monocyte Differentiation (GO:0045655),15,0.6672123267326436,-0.0149384794213524,-0.0149384794213524,143985.0,0.8878318219820439
Regulation Of Multicellular Organism Growth (GO:0040014),15,0.6672123267326436,-0.0149384794213524,-0.0149384794213524,143985.0,0.8878318219820439
Dendritic Spine Morphogenesis (GO:0060997),15,0.6672123267326436,-0.0149384794213524,-0.0149384794213524,143985.0,0.8878318219820439
Defense Response To Protozoan (GO:0042832),15,0.6672123267326436,-0.0149384794213524,-0.0149384794213524,143985.0,0.8878318219820439
Positive Regulation Of Cyclin-Dependent Protein Serine/Threonine Kinase Activity (GO:0045737),15,0.6672123267326436,-0.0149384794213524,-0.0149384794213524,143985.0,0.8878318219820439
Regulation Of Hormone Secretion (GO:0046883),15,0.6672123267326436,-0.0149384794213524,-0.0149384794213524,143985.0,0.8878318219820439
Positive Regulation Of Isotype Switching (GO:0045830),15,0.6672123267326436,-0.0149384794213524,-0.0149384794213524,143985.0,0.8878318219820439
Dendritic Cell Chemotaxis (GO:0002407),15,0.6672123267326436,-0.0149384794213524,-0.0149384794213524,143985.0,0.8878318219820439
Regulation Of Intrinsic Apoptotic Signaling Pathway In Response To DNA Damage (GO:1902229),15,0.6672123267326436,-0.0149384794213524,-0.0149384794213524,143985.0,0.8878318219820439
Positive Regulation Of Sprouting Angiogenesis (GO:1903672),15,0.6672123267326436,-0.0149384794213524,-0.0149384794213524,143985.0,0.8878318219820439
"Protein Localization To Chromosome, Telomeric Region (GO:0070198)",15,0.6672123267326436,-0.0149384794213524,-0.0149384794213524,143985.0,0.8878318219820439
Positive Regulation Of Endothelial Cell Apoptotic Process (GO:2000353),15,0.6672123267326436,-0.0149384794213524,-0.0149384794213524,143985.0,0.8878318219820439
Histone H4-K5 Acetylation (GO:0043981),15,0.6672123267326436,-0.0149384794213524,-0.0149384794213524,143985.0,0.8878318219820439
Mitotic Chromosome Condensation (GO:0007076),15,0.6672123267326436,-0.0149384794213524,-0.0149384794213524,143985.0,0.8878318219820439
Negative Regulation Of Synaptic Transmission (GO:0050805),15,0.6672123267326436,-0.0149384794213524,-0.0149384794213524,143985.0,0.8878318219820439
Sphingolipid Catabolic Process (GO:0030149),15,0.6672123267326436,-0.0149384794213524,-0.0149384794213524,143985.0,0.8878318219820439
Endoplasmic Reticulum To Cytosol Transport (GO:1903513),15,0.6672123267326436,-0.0149384794213524,-0.0149384794213524,143985.0,0.8878318219820439
Amyloid-Beta Metabolic Process (GO:0050435),15,0.6672123267326436,-0.0149384794213524,-0.0149384794213524,143985.0,0.8878318219820439
Peptidyl-Lysine Trimethylation (GO:0018023),15,0.6672123267326436,-0.0149384794213524,-0.0149384794213524,143985.0,0.8878318219820439
Anterograde Synaptic Vesicle Transport (GO:0048490),15,0.6672123267326436,-0.0149384794213524,-0.0149384794213524,143985.0,0.8878318219820439
Protein Localization To Microtubule Organizing Center (GO:1905508),15,0.6672123267326436,-0.0149384794213524,-0.0149384794213524,143985.0,0.8878318219820439
Negative Regulation Of Epithelial Cell Differentiation (GO:0030857),15,0.6672123267326436,-0.0149384794213524,-0.0149384794213524,143985.0,0.8878318219820439
3'-Phosphoadenosine 5'-Phosphosulfate Metabolic Process (GO:0050427),15,0.6672123267326436,-0.0149384794213524,-0.0149384794213524,143985.0,0.8878318219820439
Positive Regulation Of Glucose Metabolic Process (GO:0010907),15,0.6672123267326436,-0.0149384794213524,-0.0149384794213524,143985.0,0.8878318219820439
Negative Regulation Of Endoplasmic Reticulum Stress-Induced Intrinsic Apoptotic Signaling Pathway (GO:1902236),15,0.6672123267326436,-0.0149384794213524,-0.0149384794213524,143985.0,0.8878318219820439
Regulation Of Activin Receptor Signaling Pathway (GO:0032925),15,0.6672123267326436,-0.0149384794213524,-0.0149384794213524,143985.0,0.8878318219820439
mRNA Methylation (GO:0080009),15,0.6672123267326436,-0.0149384794213524,-0.0149384794213524,143985.0,0.8878318219820439
Intracellular Sterol Transport (GO:0032366),15,0.6672123267326436,-0.0149384794213524,-0.0149384794213524,143985.0,0.8878318219820439
N-acetylglucosamine Metabolic Process (GO:0006044),15,0.6672123267326436,-0.0149384794213524,-0.0149384794213524,143985.0,0.8878318219820439
"Positive Regulation Of DNA Damage Response, Signal Transduction By P53 Class Mediator (GO:0043517)",15,0.6672123267326436,-0.0149384794213524,-0.0149384794213524,143985.0,0.8878318219820439
N-terminal Protein Amino Acid Acetylation (GO:0006474),15,0.6672123267326436,-0.0149384794213524,-0.0149384794213524,143985.0,0.8878318219820439
Astrocyte Development (GO:0014002),15,0.6672123267326436,-0.0149384794213524,-0.0149384794213524,143985.0,0.8878318219820439
Regulation Of Telomere Maintenance In Response To DNA Damage (GO:1904505),15,0.6672123267326436,-0.0149384794213524,-0.0149384794213524,143985.0,0.8878318219820439
Regulation Of Systemic Arterial Blood Pressure By Hormone (GO:0001990),15,0.6672123267326436,-0.0149384794213524,-0.0149384794213524,143985.0,0.8878318219820439
Receptor Catabolic Process (GO:0032801),15,0.6672123267326436,-0.0149384794213524,-0.0149384794213524,143985.0,0.8878318219820439
Regulation Of Systemic Arterial Blood Pressure (GO:0003073),15,0.6672123267326436,-0.0149384794213524,-0.0149384794213524,143985.0,0.8878318219820439
L-glutamate Import (GO:0051938),15,0.6672123267326436,-0.0149384794213524,-0.0149384794213524,143985.0,0.8878318219820439
Arp2/3 Complex-Mediated Actin Nucleation (GO:0034314),15,0.6672123267326436,-0.0149384794213524,-0.0149384794213524,143985.0,0.8878318219820439
Synaptic Vesicle Transport Along Microtubule (GO:0099517),15,0.6672123267326436,-0.0149384794213524,-0.0149384794213524,143985.0,0.8878318219820439
3'-UTR-mediated mRNA Destabilization (GO:0061158),15,0.6672123267326436,-0.0149384794213524,-0.0149384794213524,143985.0,0.8878318219820439
Cellular Response To Corticosteroid Stimulus (GO:0071384),15,0.6672123267326436,-0.0149384794213524,-0.0149384794213524,143985.0,0.8878318219820439
tRNA Wobble Uridine Modification (GO:0002098),15,0.6672123267326436,-0.0149384794213524,-0.0149384794213524,143985.0,0.8878318219820439
Late Endosome To Lysosome Transport (GO:1902774),15,0.6672123267326436,-0.0149384794213524,-0.0149384794213524,143985.0,0.8878318219820439
tRNA Wobble Base Modification (GO:0002097),15,0.6672123267326436,-0.0149384794213524,-0.0149384794213524,143985.0,0.8878318219820439
Nuclear Migration (GO:0007097),15,0.6672123267326436,-0.0149384794213524,-0.0149384794213524,143985.0,0.8878318219820439
Positive Regulation Of Mitotic Sister Chromatid Separation (GO:1901970),15,0.6672123267326436,-0.0149384794213524,-0.0149384794213524,143985.0,0.8878318219820439
Gas Transport (GO:0015669),15,0.6672123267326436,-0.0149384794213524,-0.0149384794213524,143985.0,0.8878318219820439
Negative Regulation Of Focal Adhesion Assembly (GO:0051895),15,0.6672123267326436,-0.0149384794213524,-0.0149384794213524,143985.0,0.8878318219820439
Nuclear Chromosome Segregation (GO:0098813),15,0.6672123267326436,-0.0149384794213524,-0.0149384794213524,143985.0,0.8878318219820439
Retinal Metabolic Process (GO:0042574),15,0.6672123267326436,-0.0149384794213524,-0.0149384794213524,143985.0,0.8878318219820439
Pigment Granule Transport (GO:0051904),15,0.6672123267326436,-0.0149384794213524,-0.0149384794213524,143985.0,0.8878318219820439
Positive Regulation Of Muscle Cell Differentiation (GO:0051149),15,0.6672123267326436,-0.0149384794213524,-0.0149384794213524,143985.0,0.8878318219820439
Golgi To Endosome Transport (GO:0006895),15,0.6672123267326436,-0.0149384794213524,-0.0149384794213524,143985.0,0.8878318219820439
Retrograde Axonal Transport (GO:0008090),15,0.6672123267326436,-0.0149384794213524,-0.0149384794213524,143985.0,0.8878318219820439
Nitric Oxide Biosynthetic Process (GO:0006809),15,0.6672123267326436,-0.0149384794213524,-0.0149384794213524,143985.0,0.8878318219820439
Neurotrophin Signaling Pathway (GO:0038179),15,0.6672123267326436,-0.0149384794213524,-0.0149384794213524,143985.0,0.8878318219820439
Coenzyme A Metabolic Process (GO:0015936),15,0.6672123267326436,-0.0149384794213524,-0.0149384794213524,143985.0,0.8878318219820439
Folic Acid-Containing Compound Metabolic Process (GO:0006760),15,0.6672123267326436,-0.0149384794213524,-0.0149384794213524,143985.0,0.8878318219820439
Nucleotide-Sugar Biosynthetic Process (GO:0009226),15,0.6672123267326436,-0.0149384794213524,-0.0149384794213524,143985.0,0.8878318219820439
Midbody Abscission (GO:0061952),15,0.6672123267326436,-0.0149384794213524,-0.0149384794213524,143985.0,0.8878318219820439
Vasodilation (GO:0042311),15,0.6672123267326436,-0.0149384794213524,-0.0149384794213524,143985.0,0.8878318219820439
Negative Regulation Of Cation Transmembrane Transport (GO:1904063),15,0.6672123267326436,-0.0149384794213524,-0.0149384794213524,143985.0,0.8878318219820439
Epiboly Involved In Wound Healing (GO:0090505),15,0.6672123267326436,-0.0149384794213524,-0.0149384794213524,143985.0,0.8878318219820439
Keratan Sulfate Biosynthetic Process (GO:0018146),15,0.6672123267326436,-0.0149384794213524,-0.0149384794213524,143985.0,0.8878318219820439
T Cell Homeostasis (GO:0043029),15,0.6672123267326436,-0.0149384794213524,-0.0149384794213524,143985.0,0.8878318219820439
High-Density Lipoprotein Particle Remodeling (GO:0034375),15,0.6672123267326436,-0.0149384794213524,-0.0149384794213524,143985.0,0.8878318219820439
Negative Regulation Of mRNA Processing (GO:0050686),15,0.6672123267326436,-0.0149384794213524,-0.0149384794213524,143985.0,0.8878318219820439
Regulation Of Carbohydrate Metabolic Process (GO:0006109),15,0.6672123267326436,-0.0149384794213524,-0.0149384794213524,143985.0,0.8878318219820439
Regulation Of Amyloid Fibril Formation (GO:1905906),15,0.6672123267326436,-0.0149384794213524,-0.0149384794213524,143985.0,0.8878318219820439
Glutamine Family Amino Acid Catabolic Process (GO:0009065),15,0.6672123267326436,-0.0149384794213524,-0.0149384794213524,143985.0,0.8878318219820439
Digestive Tract Morphogenesis (GO:0048546),15,0.6672123267326436,-0.0149384794213524,-0.0149384794213524,143985.0,0.8878318219820439
Negative Regulation Of Cell-Substrate Junction Organization (GO:0150118),15,0.6672123267326436,-0.0149384794213524,-0.0149384794213524,143985.0,0.8878318219820439
Melanosome Transport (GO:0032402),15,0.6672123267326436,-0.0149384794213524,-0.0149384794213524,143985.0,0.8878318219820439
DNA Alkylation (GO:0006305),15,0.6672123267326436,-0.0149384794213524,-0.0149384794213524,143985.0,0.8878318219820439
Cellular Response To Sterol (GO:0036315),15,0.6672123267326436,-0.0149384794213524,-0.0149384794213524,143985.0,0.8878318219820439
Regulation Of Bicellular Tight Junction Assembly (GO:2000810),15,0.6672123267326436,-0.0149384794213524,-0.0149384794213524,143985.0,0.8878318219820439
Positive Regulation Of Potassium Ion Transport (GO:0043268),15,0.6672123267326436,-0.0149384794213524,-0.0149384794213524,143985.0,0.8878318219820439
Regulation Of Amyloid-Beta Clearance (GO:1900221),15,0.6672123267326436,-0.0149384794213524,-0.0149384794213524,143985.0,0.8878318219820439
Positive Regulation Of Immunoglobulin Mediated Immune Response (GO:0002891),15,0.6672123267326436,-0.0149384794213524,-0.0149384794213524,143985.0,0.8878318219820439
Regulation Of Tumor Necrosis Factor Production (GO:0032680),126,0.669051663917531,-0.005967280382890226,-0.0149384794213524,1212296.0,0.8878318219820439
Golgi Organization (GO:0007030),127,0.671694554814287,0.004933612683032536,-0.0149384794213524,1221787.0,0.8878318219820439
Protein Targeting To Peroxisome (GO:0006625),16,0.6723484985213354,-0.0149384794213524,-0.0149384794213524,153576.0,0.8878318219820439
Regulation Of Autophagosome Maturation (GO:1901096),16,0.6723484985213354,-0.0149384794213524,-0.0149384794213524,153576.0,0.8878318219820439
Negative Regulation Of RNA Biosynthetic Process (GO:1902679),16,0.6723484985213354,-0.0149384794213524,-0.0149384794213524,153576.0,0.8878318219820439
Antifungal Innate Immune Response (GO:0061760),16,0.6723484985213354,-0.0149384794213524,-0.0149384794213524,153576.0,0.8878318219820439
Embryonic Axis Specification (GO:0000578),16,0.6723484985213354,-0.0149384794213524,-0.0149384794213524,153576.0,0.8878318219820439
Negative Regulation Of Cytokine Production Involved In Immune Response (GO:0002719),16,0.6723484985213354,-0.0149384794213524,-0.0149384794213524,153576.0,0.8878318219820439
Regulation Of Centriole Replication (GO:0046599),16,0.6723484985213354,-0.0149384794213524,-0.0149384794213524,153576.0,0.8878318219820439
Regulation Of Blood Vessel Endothelial Cell Proliferation Involved In Sprouting Angiogenesis (GO:1903587),16,0.6723484985213354,-0.0149384794213524,-0.0149384794213524,153576.0,0.8878318219820439
cGMP-mediated Signaling (GO:0019934),16,0.6723484985213354,-0.0149384794213524,-0.0149384794213524,153576.0,0.8878318219820439
Negative Regulation Of Amyloid-Beta Formation (GO:1902430),16,0.6723484985213354,-0.0149384794213524,-0.0149384794213524,153576.0,0.8878318219820439
Cellular Response To Fatty Acid (GO:0071398),16,0.6723484985213354,-0.0149384794213524,-0.0149384794213524,153576.0,0.8878318219820439
