Pathway,n_genes,p_val,mean_score,median_score,stat,FDR
Positive Regulation By Host Of Viral Process (GO:0044794),17,0.744797015501348,-0.050796008001705,-0.050796008001705,161092.0,0.9364414274734453
Androgen Receptor Signaling Pathway (GO:0030521),17,0.744797015501348,-0.050796008001705,-0.050796008001705,161092.0,0.9364414274734453
Carbohydrate Derivative Transport (GO:1901264),17,0.744797015501348,-0.050796008001705,-0.050796008001705,161092.0,0.9364414274734453
Regulation Of Brown Fat Cell Differentiation (GO:0090335),17,0.744797015501348,-0.050796008001705,-0.050796008001705,161092.0,0.9364414274734453
Negative Regulation Of Ubiquitin-Protein Transferase Activity (GO:0051444),17,0.744797015501348,-0.050796008001705,-0.050796008001705,161092.0,0.9364414274734453
Regulation Of Cartilage Development (GO:0061035),17,0.744797015501348,-0.050796008001705,-0.050796008001705,161092.0,0.9364414274734453
Branched-Chain Amino Acid Catabolic Process (GO:0009083),17,0.744797015501348,-0.050796008001705,-0.050796008001705,161092.0,0.9364414274734453
Negative Regulation Of Calcium Ion Transport (GO:0051926),17,0.744797015501348,-0.050796008001705,-0.050796008001705,161092.0,0.9364414274734453
Base Conversion Or Substitution Editing (GO:0016553),17,0.744797015501348,-0.050796008001705,-0.050796008001705,161092.0,0.9364414274734453
Intracellular Lipid Transport (GO:0032365),17,0.744797015501348,-0.050796008001705,-0.050796008001705,161092.0,0.9364414274734453
Aorta Morphogenesis (GO:0035909),17,0.744797015501348,-0.050796008001705,-0.050796008001705,161092.0,0.9364414274734453
Positive Regulation Of Transcription From RNA Polymerase II Promoter In Response To Stress (GO:0036003),17,0.744797015501348,-0.050796008001705,-0.050796008001705,161092.0,0.9364414274734453
Regulation Of Single Stranded Viral RNA Replication Via Double Stranded DNA Intermediate (GO:0045091),17,0.744797015501348,-0.050796008001705,-0.050796008001705,161092.0,0.9364414274734453
"Nuclear-Transcribed mRNA Catabolic Process, Exonucleolytic (GO:0000291)",17,0.744797015501348,-0.050796008001705,-0.050796008001705,161092.0,0.9364414274734453
Intracellular Estrogen Receptor Signaling Pathway (GO:0030520),17,0.744797015501348,-0.050796008001705,-0.050796008001705,161092.0,0.9364414274734453
Negative Regulation Of Rho Protein Signal Transduction (GO:0035024),17,0.744797015501348,-0.050796008001705,-0.050796008001705,161092.0,0.9364414274734453
Cellular Response To Unfolded Protein (GO:0034620),17,0.744797015501348,-0.050796008001705,-0.050796008001705,161092.0,0.9364414274734453
Regulation Of Mitotic Cell Cycle Spindle Assembly Checkpoint (GO:0090266),17,0.744797015501348,-0.050796008001705,-0.050796008001705,161092.0,0.9364414274734453
Leukotriene Biosynthetic Process (GO:0019370),17,0.744797015501348,-0.050796008001705,-0.050796008001705,161092.0,0.9364414274734453
Hippo Signaling (GO:0035329),17,0.744797015501348,-0.050796008001705,-0.050796008001705,161092.0,0.9364414274734453
Positive Regulation Of Alpha-Beta T Cell Proliferation (GO:0046641),17,0.744797015501348,-0.050796008001705,-0.050796008001705,161092.0,0.9364414274734453
Growth Hormone Receptor Signaling Pathway (GO:0060396),17,0.744797015501348,-0.050796008001705,-0.050796008001705,161092.0,0.9364414274734453
Water Transport (GO:0006833),17,0.744797015501348,-0.050796008001705,-0.050796008001705,161092.0,0.9364414274734453
Positive Regulation Of SMAD Protein Signal Transduction (GO:0060391),17,0.744797015501348,-0.050796008001705,-0.050796008001705,161092.0,0.9364414274734453
Central Nervous System Neuron Development (GO:0021954),17,0.744797015501348,-0.050796008001705,-0.050796008001705,161092.0,0.9364414274734453
DNA Biosynthetic Process (GO:0071897),17,0.744797015501348,-0.050796008001705,-0.050796008001705,161092.0,0.9364414274734453
Protein Localization To Centrosome (GO:0071539),17,0.744797015501348,-0.050796008001705,-0.050796008001705,161092.0,0.9364414274734453
DNA Modification (GO:0006304),17,0.744797015501348,-0.050796008001705,-0.050796008001705,161092.0,0.9364414274734453
Intracellular Zinc Ion Homeostasis (GO:0006882),17,0.744797015501348,-0.050796008001705,-0.050796008001705,161092.0,0.9364414274734453
Immunoglobulin Production Involved In Immunoglobulin-Mediated Immune Response (GO:0002381),17,0.744797015501348,-0.050796008001705,-0.050796008001705,161092.0,0.9364414274734453
Sensory Perception Of Taste (GO:0050909),17,0.744797015501348,-0.050796008001705,-0.050796008001705,161092.0,0.9364414274734453
Regulation Of Synaptic Vesicle Exocytosis (GO:2000300),17,0.744797015501348,-0.050796008001705,-0.050796008001705,161092.0,0.9364414274734453
NLS-bearing Protein Import Into Nucleus (GO:0006607),17,0.744797015501348,-0.050796008001705,-0.050796008001705,161092.0,0.9364414274734453
Cellular Response To dsRNA (GO:0071359),17,0.744797015501348,-0.050796008001705,-0.050796008001705,161092.0,0.9364414274734453
Epoxygenase P450 Pathway (GO:0019373),17,0.744797015501348,-0.050796008001705,-0.050796008001705,161092.0,0.9364414274734453
Sulfur Amino Acid Metabolic Process (GO:0000096),17,0.744797015501348,-0.050796008001705,-0.050796008001705,161092.0,0.9364414274734453
Neural Tube Development (GO:0021915),17,0.744797015501348,-0.050796008001705,-0.050796008001705,161092.0,0.9364414274734453
Regulation Of Establishment Of Cell Polarity (GO:2000114),17,0.744797015501348,-0.050796008001705,-0.050796008001705,161092.0,0.9364414274734453
Negative Regulation Of Cellular Senescence (GO:2000773),17,0.744797015501348,-0.050796008001705,-0.050796008001705,161092.0,0.9364414274734453
Positive Regulation Of Cartilage Development (GO:0061036),17,0.744797015501348,-0.050796008001705,-0.050796008001705,161092.0,0.9364414274734453
Negative Regulation Of Fibroblast Proliferation (GO:0048147),17,0.744797015501348,-0.050796008001705,-0.050796008001705,161092.0,0.9364414274734453
ncRNA Metabolic Process (GO:0034660),17,0.744797015501348,-0.050796008001705,-0.050796008001705,161092.0,0.9364414274734453
Positive Regulation Of Regulatory T Cell Differentiation (GO:0045591),17,0.744797015501348,-0.050796008001705,-0.050796008001705,161092.0,0.9364414274734453
NAD Biosynthetic Process (GO:0009435),17,0.744797015501348,-0.050796008001705,-0.050796008001705,161092.0,0.9364414274734453
Positive Regulation Of Cardiac Muscle Hypertrophy (GO:0010613),17,0.744797015501348,-0.050796008001705,-0.050796008001705,161092.0,0.9364414274734453
Regulation Of Protein Sumoylation (GO:0033233),17,0.744797015501348,-0.050796008001705,-0.050796008001705,161092.0,0.9364414274734453
Golgi To Vacuole Transport (GO:0006896),17,0.744797015501348,-0.050796008001705,-0.050796008001705,161092.0,0.9364414274734453
Cellular Response To Glucocorticoid Stimulus (GO:0071385),17,0.744797015501348,-0.050796008001705,-0.050796008001705,161092.0,0.9364414274734453
Positive Regulation Of JNK Cascade (GO:0046330),77,0.7449409412104132,-0.029613683381208913,-0.050796008001705,737207.0,0.9364414274734453
Positive Regulation Of Peptidyl-Tyrosine Phosphorylation (GO:0050731),128,0.7456422665170467,-0.034671409112807514,-0.050796008001705,1225457.0,0.9364414274734453
Sphingolipid Biosynthetic Process (GO:0030148),77,0.7472129489184822,-0.045213952936491615,-0.050796008001705,737113.0,0.9364414274734453
Spindle Assembly (GO:0051225),78,0.7495935380482844,-0.0326535665385911,-0.050796008001705,746605.0,0.9364414274734453
Transmembrane Receptor Protein Serine/Threonine Kinase Signaling Pathway (GO:0007178),129,0.7500356333530205,-0.041364447242151485,-0.050796008001705,1234775.0,0.9364414274734453
Positive Regulation Of ERK1 And ERK2 Cascade (GO:0070374),176,0.7503445268722244,-0.048030357274338936,-0.050796008001705,1682784.0,0.9364414274734453
Regulation Of Mitochondrial Membrane Permeability (GO:0046902),18,0.750892473346511,-0.050796008001705,-0.050796008001705,170559.0,0.9364414274734453
Negative Regulation Of Viral Entry Into Host Cell (GO:0046597),18,0.750892473346511,-0.050796008001705,-0.050796008001705,170559.0,0.9364414274734453
Regulation Of cAMP-mediated Signaling (GO:0043949),18,0.750892473346511,-0.050796008001705,-0.050796008001705,170559.0,0.9364414274734453
Vesicle Transport Along Actin Filament (GO:0030050),18,0.750892473346511,-0.050796008001705,-0.050796008001705,170559.0,0.9364414274734453
Ureteric Bud Morphogenesis (GO:0060675),18,0.750892473346511,-0.050796008001705,-0.050796008001705,170559.0,0.9364414274734453
Positive Regulation Of Macrophage Migration (GO:1905523),18,0.750892473346511,-0.050796008001705,-0.050796008001705,170559.0,0.9364414274734453
Protein Autoprocessing (GO:0016540),18,0.750892473346511,-0.050796008001705,-0.050796008001705,170559.0,0.9364414274734453
Melanosome Localization (GO:0032400),18,0.750892473346511,-0.050796008001705,-0.050796008001705,170559.0,0.9364414274734453
Nucleosome Disassembly (GO:0006337),18,0.750892473346511,-0.050796008001705,-0.050796008001705,170559.0,0.9364414274734453
Regulation Of Protein Neddylation (GO:2000434),18,0.750892473346511,-0.050796008001705,-0.050796008001705,170559.0,0.9364414274734453
Negative Regulation Of Signal Transduction By P53 Class Mediator (GO:1901797),18,0.750892473346511,-0.050796008001705,-0.050796008001705,170559.0,0.9364414274734453
Regulation Of Early Endosome To Late Endosome Transport (GO:2000641),18,0.750892473346511,-0.050796008001705,-0.050796008001705,170559.0,0.9364414274734453
Mesenchyme Morphogenesis (GO:0072132),18,0.750892473346511,-0.050796008001705,-0.050796008001705,170559.0,0.9364414274734453
fatty-acyl-CoA Metabolic Process (GO:0035337),18,0.750892473346511,-0.050796008001705,-0.050796008001705,170559.0,0.9364414274734453
Regulation Of Lymphocyte Activation (GO:0051249),18,0.750892473346511,-0.050796008001705,-0.050796008001705,170559.0,0.9364414274734453
Regulation Of Oxidative Stress-Induced Intrinsic Apoptotic Signaling Pathway (GO:1902175),18,0.750892473346511,-0.050796008001705,-0.050796008001705,170559.0,0.9364414274734453
Response To Axon Injury (GO:0048678),18,0.750892473346511,-0.050796008001705,-0.050796008001705,170559.0,0.9364414274734453
Icosanoid Biosynthetic Process (GO:0046456),18,0.750892473346511,-0.050796008001705,-0.050796008001705,170559.0,0.9364414274734453
Negative Regulation Of Lipid Storage (GO:0010888),18,0.750892473346511,-0.050796008001705,-0.050796008001705,170559.0,0.9364414274734453
"Protein Localization To Chromosome, Centromeric Region (GO:0071459)",18,0.750892473346511,-0.050796008001705,-0.050796008001705,170559.0,0.9364414274734453
Cilium-Dependent Cell Motility (GO:0060285),18,0.750892473346511,-0.050796008001705,-0.050796008001705,170559.0,0.9364414274734453
Neuromuscular Process (GO:0050905),18,0.750892473346511,-0.050796008001705,-0.050796008001705,170559.0,0.9364414274734453
Positive Regulation Of Response To Endoplasmic Reticulum Stress (GO:1905898),18,0.750892473346511,-0.050796008001705,-0.050796008001705,170559.0,0.9364414274734453
Regulation Of Establishment Or Maintenance Of Cell Polarity (GO:0032878),18,0.750892473346511,-0.050796008001705,-0.050796008001705,170559.0,0.9364414274734453
Glucose 6-Phosphate Metabolic Process (GO:0051156),18,0.750892473346511,-0.050796008001705,-0.050796008001705,170559.0,0.9364414274734453
Branching Involved In Ureteric Bud Morphogenesis (GO:0001658),18,0.750892473346511,-0.050796008001705,-0.050796008001705,170559.0,0.9364414274734453
Positive Regulation Of Phosphoprotein Phosphatase Activity (GO:0032516),18,0.750892473346511,-0.050796008001705,-0.050796008001705,170559.0,0.9364414274734453
Regulation Of Cell Cycle G2/M Phase Transition (GO:1902749),18,0.750892473346511,-0.050796008001705,-0.050796008001705,170559.0,0.9364414274734453
Antigen Processing And Presentation Of Peptide Antigen Via MHC Class I (GO:0002474),18,0.750892473346511,-0.050796008001705,-0.050796008001705,170559.0,0.9364414274734453
Adrenergic Receptor Signaling Pathway (GO:0071875),18,0.750892473346511,-0.050796008001705,-0.050796008001705,170559.0,0.9364414274734453
Regulation Of Protein Deacetylation (GO:0090311),18,0.750892473346511,-0.050796008001705,-0.050796008001705,170559.0,0.9364414274734453
Positive Regulation Of Stress-Activated Protein Kinase Signaling Cascade (GO:0070304),18,0.750892473346511,-0.050796008001705,-0.050796008001705,170559.0,0.9364414274734453
Negative Regulation Of Nervous System Development (GO:0051961),18,0.750892473346511,-0.050796008001705,-0.050796008001705,170559.0,0.9364414274734453
Pulmonary Valve Morphogenesis (GO:0003184),18,0.750892473346511,-0.050796008001705,-0.050796008001705,170559.0,0.9364414274734453
Positive Regulation Of Osteoclast Differentiation (GO:0045672),18,0.750892473346511,-0.050796008001705,-0.050796008001705,170559.0,0.9364414274734453
Intracellular Sodium Ion Homeostasis (GO:0006883),18,0.750892473346511,-0.050796008001705,-0.050796008001705,170559.0,0.9364414274734453
Cardiac Atrium Morphogenesis (GO:0003209),18,0.750892473346511,-0.050796008001705,-0.050796008001705,170559.0,0.9364414274734453
Associative Learning (GO:0008306),18,0.750892473346511,-0.050796008001705,-0.050796008001705,170559.0,0.9364414274734453
Regulation Of Epithelial Cell Differentiation (GO:0030856),18,0.750892473346511,-0.050796008001705,-0.050796008001705,170559.0,0.9364414274734453
Regulation Of Mitochondrial Outer Membrane Permeabilization Involved In Apoptotic Signaling Pathway (GO:1901028),18,0.750892473346511,-0.050796008001705,-0.050796008001705,170559.0,0.9364414274734453
Heart Trabecula Morphogenesis (GO:0061384),18,0.750892473346511,-0.050796008001705,-0.050796008001705,170559.0,0.9364414274734453
Cellular Response To Inorganic Substance (GO:0071241),18,0.750892473346511,-0.050796008001705,-0.050796008001705,170559.0,0.9364414274734453
Positive Regulation Of Natural Killer Cell Activation (GO:0032816),18,0.750892473346511,-0.050796008001705,-0.050796008001705,170559.0,0.9364414274734453
Regulation Of Epidermal Cell Differentiation (GO:0045604),18,0.750892473346511,-0.050796008001705,-0.050796008001705,170559.0,0.9364414274734453
Maintenance Of Protein Location In Nucleus (GO:0051457),18,0.750892473346511,-0.050796008001705,-0.050796008001705,170559.0,0.9364414274734453
Positive Regulation Of Nervous System Process (GO:0031646),18,0.750892473346511,-0.050796008001705,-0.050796008001705,170559.0,0.9364414274734453
Regulation Of Exosomal Secretion (GO:1903541),18,0.750892473346511,-0.050796008001705,-0.050796008001705,170559.0,0.9364414274734453
Positive Regulation Of Triglyceride Metabolic Process (GO:0090208),18,0.750892473346511,-0.050796008001705,-0.050796008001705,170559.0,0.9364414274734453
Maintenance Of Gastrointestinal Epithelium (GO:0030277),18,0.750892473346511,-0.050796008001705,-0.050796008001705,170559.0,0.9364414274734453
Positive Regulation Of Neutrophil Chemotaxis (GO:0090023),18,0.750892473346511,-0.050796008001705,-0.050796008001705,170559.0,0.9364414274734453
Regulation Of Peptidyl-Serine Phosphorylation Of STAT Protein (GO:0033139),18,0.750892473346511,-0.050796008001705,-0.050796008001705,170559.0,0.9364414274734453
Maintenance Of Protein Localization In Organelle (GO:0072595),18,0.750892473346511,-0.050796008001705,-0.050796008001705,170559.0,0.9364414274734453
Positive Regulation Of Neuroblast Proliferation (GO:0002052),18,0.750892473346511,-0.050796008001705,-0.050796008001705,170559.0,0.9364414274734453
Barbed-End Actin Filament Capping (GO:0051016),18,0.750892473346511,-0.050796008001705,-0.050796008001705,170559.0,0.9364414274734453
Positive Regulation Of Cytokine Production Involved In Inflammatory Response (GO:1900017),18,0.750892473346511,-0.050796008001705,-0.050796008001705,170559.0,0.9364414274734453
Positive Regulation Of Cation Transmembrane Transport (GO:1904064),18,0.750892473346511,-0.050796008001705,-0.050796008001705,170559.0,0.9364414274734453
Mitochondrial Fusion (GO:0008053),18,0.750892473346511,-0.050796008001705,-0.050796008001705,170559.0,0.9364414274734453
Epithelial Cilium Movement Involved In Extracellular Fluid Movement (GO:0003351),18,0.750892473346511,-0.050796008001705,-0.050796008001705,170559.0,0.9364414274734453
Actin Filament Capping (GO:0051693),18,0.750892473346511,-0.050796008001705,-0.050796008001705,170559.0,0.9364414274734453
snRNA Processing (GO:0016180),18,0.750892473346511,-0.050796008001705,-0.050796008001705,170559.0,0.9364414274734453
Positive Regulation Of Glycolytic Process (GO:0045821),18,0.750892473346511,-0.050796008001705,-0.050796008001705,170559.0,0.9364414274734453
Negative Regulation Of Fatty Acid Metabolic Process (GO:0045922),18,0.750892473346511,-0.050796008001705,-0.050796008001705,170559.0,0.9364414274734453
T-helper Cell Differentiation (GO:0042093),18,0.750892473346511,-0.050796008001705,-0.050796008001705,170559.0,0.9364414274734453
Response To Organophosphorus (GO:0046683),18,0.750892473346511,-0.050796008001705,-0.050796008001705,170559.0,0.9364414274734453
Negative Regulation Of Peptide Hormone Secretion (GO:0090278),18,0.750892473346511,-0.050796008001705,-0.050796008001705,170559.0,0.9364414274734453
Regulation Of Adaptive Immune Response (GO:0002819),18,0.750892473346511,-0.050796008001705,-0.050796008001705,170559.0,0.9364414274734453
Regulation Of RIG-I Signaling Pathway (GO:0039535),18,0.750892473346511,-0.050796008001705,-0.050796008001705,170559.0,0.9364414274734453
Positive Regulation Of calcineurin-NFAT Signaling Cascade (GO:0070886),18,0.750892473346511,-0.050796008001705,-0.050796008001705,170559.0,0.9364414274734453
Positive Regulation Of Focal Adhesion Assembly (GO:0051894),18,0.750892473346511,-0.050796008001705,-0.050796008001705,170559.0,0.9364414274734453
Positive Regulation Of Calcineurin-Mediated Signaling (GO:0106058),18,0.750892473346511,-0.050796008001705,-0.050796008001705,170559.0,0.9364414274734453
Positive Regulation Of Chromosome Segregation (GO:0051984),18,0.750892473346511,-0.050796008001705,-0.050796008001705,170559.0,0.9364414274734453
Detection Of Mechanical Stimulus (GO:0050982),18,0.750892473346511,-0.050796008001705,-0.050796008001705,170559.0,0.9364414274734453
ncRNA-mediated Post-Transcriptional Gene Silencing (GO:0035194),18,0.750892473346511,-0.050796008001705,-0.050796008001705,170559.0,0.9364414274734453
Positive Regulation Of Alpha-Beta T Cell Activation (GO:0046635),18,0.750892473346511,-0.050796008001705,-0.050796008001705,170559.0,0.9364414274734453
Mitotic Cytokinetic Process (GO:1902410),18,0.750892473346511,-0.050796008001705,-0.050796008001705,170559.0,0.9364414274734453
Positive Regulation Of Extracellular Matrix Organization (GO:1903055),18,0.750892473346511,-0.050796008001705,-0.050796008001705,170559.0,0.9364414274734453
Epithelial Cell Development (GO:0002064),18,0.750892473346511,-0.050796008001705,-0.050796008001705,170559.0,0.9364414274734453
Regulation Of Defense Response To Virus (GO:0050688),18,0.750892473346511,-0.050796008001705,-0.050796008001705,170559.0,0.9364414274734453
Positive Regulation Of Cyclin-Dependent Protein Kinase Activity (GO:1904031),18,0.750892473346511,-0.050796008001705,-0.050796008001705,170559.0,0.9364414274734453
Establishment Of Epithelial Cell Polarity (GO:0090162),18,0.750892473346511,-0.050796008001705,-0.050796008001705,170559.0,0.9364414274734453
Nitric Oxide Mediated Signal Transduction (GO:0007263),18,0.750892473346511,-0.050796008001705,-0.050796008001705,170559.0,0.9364414274734453
Cell Junction Maintenance (GO:0034331),18,0.750892473346511,-0.050796008001705,-0.050796008001705,170559.0,0.9364414274734453
Myoblast Fusion (GO:0007520),18,0.750892473346511,-0.050796008001705,-0.050796008001705,170559.0,0.9364414274734453
Vesicle-Mediated Transport In Synapse (GO:0099003),18,0.750892473346511,-0.050796008001705,-0.050796008001705,170559.0,0.9364414274734453
Regulation Of Histone Modification (GO:0031056),18,0.750892473346511,-0.050796008001705,-0.050796008001705,170559.0,0.9364414274734453
Establishment Of Vesicle Localization (GO:0051650),18,0.750892473346511,-0.050796008001705,-0.050796008001705,170559.0,0.9364414274734453
Neutrophil Activation (GO:0042119),18,0.750892473346511,-0.050796008001705,-0.050796008001705,170559.0,0.9364414274734453
Regulation Of T Cell Cytokine Production (GO:0002724),18,0.750892473346511,-0.050796008001705,-0.050796008001705,170559.0,0.9364414274734453
Response To Cholesterol (GO:0070723),18,0.750892473346511,-0.050796008001705,-0.050796008001705,170559.0,0.9364414274734453
"Negative Regulation Of DNA-templated Transcription, Elongation (GO:0032785)",18,0.750892473346511,-0.050796008001705,-0.050796008001705,170559.0,0.9364414274734453
Regulation Of Lymphocyte Proliferation (GO:0050670),18,0.750892473346511,-0.050796008001705,-0.050796008001705,170559.0,0.9364414274734453
Cellular Response To Copper Ion (GO:0071280),18,0.750892473346511,-0.050796008001705,-0.050796008001705,170559.0,0.9364414274734453
Positive Regulation Of Epidermal Cell Differentiation (GO:0045606),18,0.750892473346511,-0.050796008001705,-0.050796008001705,170559.0,0.9364414274734453
Positive Regulation Of Endocytosis (GO:0045807),79,0.7518231146029969,0.07648638539436825,-0.050796008001705,756101.0,0.9364414274734453
Positive Regulation Of Protein Localization To Membrane (GO:1905477),79,0.7521295074245955,0.03907918531525288,-0.050796008001705,756088.0,0.9364414274734453
Intracellular Protein Transport (GO:0006886),321,0.7522984176616345,-0.0033246229676640645,-0.050796008001705,3052191.0,0.9364414274734453
Regulation Of Kinase Activity (GO:0043549),79,0.7539636164713279,-0.032895542186108066,-0.050796008001705,756010.0,0.9364414274734453
Epithelial Cell Differentiation (GO:0030855),131,0.755857609821412,-0.03552679478375298,-0.050796008001705,1253560.0,0.9364414274734453
Positive Regulation Of Protein Modification By Small Protein Conjugation Or Removal (GO:1903322),79,0.756070815891293,-0.045946601041216964,-0.050796008001705,755920.0,0.9364414274734453
Ganglioside Metabolic Process (GO:0001573),19,0.7567462007486089,-0.05079600800170501,-0.050796008001705,180025.0,0.9364414274734453
DNA Catabolic Process (GO:0006308),19,0.7567462007486089,-0.05079600800170501,-0.050796008001705,180025.0,0.9364414274734453
Regulation Of Steroid Metabolic Process (GO:0019218),19,0.7567462007486089,-0.05079600800170501,-0.050796008001705,180025.0,0.9364414274734453
Establishment Of Skin Barrier (GO:0061436),19,0.7567462007486089,-0.05079600800170501,-0.050796008001705,180025.0,0.9364414274734453
Purine Ribonucleotide Transport (GO:0015868),19,0.7567462007486089,-0.05079600800170501,-0.050796008001705,180025.0,0.9364414274734453
Regulation Of Cellular Response To Growth Factor Stimulus (GO:0090287),19,0.7567462007486089,-0.05079600800170501,-0.050796008001705,180025.0,0.9364414274734453
Regulation Of B Cell Differentiation (GO:0045577),19,0.7567462007486089,-0.05079600800170501,-0.050796008001705,180025.0,0.9364414274734453
Oligodendrocyte Differentiation (GO:0048709),19,0.7567462007486089,-0.05079600800170501,-0.050796008001705,180025.0,0.9364414274734453
piRNA Processing (GO:0034587),19,0.7567462007486089,-0.05079600800170501,-0.050796008001705,180025.0,0.9364414274734453
Late Endosome To Vacuole Transport (GO:0045324),19,0.7567462007486089,-0.05079600800170501,-0.050796008001705,180025.0,0.9364414274734453
Glycosphingolipid Biosynthetic Process (GO:0006688),19,0.7567462007486089,-0.05079600800170501,-0.050796008001705,180025.0,0.9364414274734453
Xenobiotic Transport (GO:0042908),19,0.7567462007486089,-0.05079600800170501,-0.050796008001705,180025.0,0.9364414274734453
Regulation Of Neuroinflammatory Response (GO:0150077),19,0.7567462007486089,-0.05079600800170501,-0.050796008001705,180025.0,0.9364414274734453
Vesicle Docking (GO:0048278),19,0.7567462007486089,-0.05079600800170501,-0.050796008001705,180025.0,0.9364414274734453
Linoleic Acid Metabolic Process (GO:0043651),19,0.7567462007486089,-0.05079600800170501,-0.050796008001705,180025.0,0.9364414274734453
Stimulatory C-type Lectin Receptor Signaling Pathway (GO:0002223),19,0.7567462007486089,-0.05079600800170501,-0.050796008001705,180025.0,0.9364414274734453
Embryonic Digestive Tract Development (GO:0048566),19,0.7567462007486089,-0.05079600800170501,-0.050796008001705,180025.0,0.9364414274734453
Regulation Of Phosphatase Activity (GO:0010921),19,0.7567462007486089,-0.05079600800170501,-0.050796008001705,180025.0,0.9364414274734453
Regulation Of Transcription Involved In G1/S Transition Of Mitotic Cell Cycle (GO:0000083),19,0.7567462007486089,-0.05079600800170501,-0.050796008001705,180025.0,0.9364414274734453
Intrinsic Apoptotic Signaling Pathway In Response To DNA Damage By P53 Class Mediator (GO:0042771),19,0.7567462007486089,-0.05079600800170501,-0.050796008001705,180025.0,0.9364414274734453
Negative Regulation Of Peptidyl-Serine Phosphorylation (GO:0033137),19,0.7567462007486089,-0.05079600800170501,-0.050796008001705,180025.0,0.9364414274734453
tRNA Metabolic Process (GO:0006399),19,0.7567462007486089,-0.05079600800170501,-0.050796008001705,180025.0,0.9364414274734453
Glycogen Metabolic Process (GO:0005977),19,0.7567462007486089,-0.05079600800170501,-0.050796008001705,180025.0,0.9364414274734453
Epithelial Structure Maintenance (GO:0010669),19,0.7567462007486089,-0.05079600800170501,-0.050796008001705,180025.0,0.9364414274734453
Multicellular Organismal-Level Water Homeostasis (GO:0050891),19,0.7567462007486089,-0.05079600800170501,-0.050796008001705,180025.0,0.9364414274734453
RNA-templated DNA Biosynthetic Process (GO:0006278),19,0.7567462007486089,-0.05079600800170501,-0.050796008001705,180025.0,0.9364414274734453
Transport Along Microtubule (GO:0010970),19,0.7567462007486089,-0.05079600800170501,-0.050796008001705,180025.0,0.9364414274734453
Calcium-Independent Cell-Cell Adhesion Via Plasma Membrane Cell-Adhesion Molecules (GO:0016338),19,0.7567462007486089,-0.05079600800170501,-0.050796008001705,180025.0,0.9364414274734453
