Pathway,n_genes,p_val,mean_score,median_score,stat,FDR
Dendritic Spine Organization (GO:0097061),26,0.7922213958415039,-0.050796008001704994,-0.050796008001705,246259.0,0.9364414274734453
Regulation Of Chromosome Segregation (GO:0051983),26,0.7922213958415039,-0.050796008001704994,-0.050796008001705,246259.0,0.9364414274734453
Regulation Of Mitochondrial Fission (GO:0090140),26,0.7922213958415039,-0.050796008001704994,-0.050796008001705,246259.0,0.9364414274734453
Antigen Processing And Presentation Of Peptide Antigen Via MHC Class II (GO:0002495),26,0.7922213958415039,-0.050796008001704994,-0.050796008001705,246259.0,0.9364414274734453
DNA-templated Transcription Elongation (GO:0006354),26,0.7922213958415039,-0.050796008001704994,-0.050796008001705,246259.0,0.9364414274734453
Plasma Membrane Invagination (GO:0099024),26,0.7922213958415039,-0.050796008001704994,-0.050796008001705,246259.0,0.9364414274734453
Positive Regulation Of Nuclear Division (GO:0051785),26,0.7922213958415039,-0.050796008001704994,-0.050796008001705,246259.0,0.9364414274734453
Acute Inflammatory Response (GO:0002526),26,0.7922213958415039,-0.050796008001704994,-0.050796008001705,246259.0,0.9364414274734453
Negative Regulation Of Protein Polymerization (GO:0032272),26,0.7922213958415039,-0.050796008001704994,-0.050796008001705,246259.0,0.9364414274734453
Positive Regulation Of Microtubule Polymerization Or Depolymerization (GO:0031112),26,0.7922213958415039,-0.050796008001704994,-0.050796008001705,246259.0,0.9364414274734453
Respiratory Chain Complex IV Assembly (GO:0008535),26,0.7922213958415039,-0.050796008001704994,-0.050796008001705,246259.0,0.9364414274734453
Organelle Membrane Fusion (GO:0090174),26,0.7922213958415039,-0.050796008001704994,-0.050796008001705,246259.0,0.9364414274734453
Regulation Of Fatty Acid Biosynthetic Process (GO:0042304),26,0.7922213958415039,-0.050796008001704994,-0.050796008001705,246259.0,0.9364414274734453
Organelle Fusion (GO:0048284),26,0.7922213958415039,-0.050796008001704994,-0.050796008001705,246259.0,0.9364414274734453
miRNA-mediated Gene Silencing (GO:0035195),26,0.7922213958415039,-0.050796008001704994,-0.050796008001705,246259.0,0.9364414274734453
Response To Glucocorticoid (GO:0051384),26,0.7922213958415039,-0.050796008001704994,-0.050796008001705,246259.0,0.9364414274734453
Mitotic G1 DNA Damage Checkpoint Signaling (GO:0031571),26,0.7922213958415039,-0.050796008001704994,-0.050796008001705,246259.0,0.9364414274734453
Mitotic Spindle Assembly Checkpoint Signaling (GO:0007094),26,0.7922213958415039,-0.050796008001704994,-0.050796008001705,246259.0,0.9364414274734453
Mitotic Spindle Checkpoint Signaling (GO:0071174),26,0.7922213958415039,-0.050796008001704994,-0.050796008001705,246259.0,0.9364414274734453
Negative Regulation Of Insulin Receptor Signaling Pathway (GO:0046627),26,0.7922213958415039,-0.050796008001704994,-0.050796008001705,246259.0,0.9364414274734453
Nuclear Membrane Organization (GO:0071763),26,0.7922213958415039,-0.050796008001704994,-0.050796008001705,246259.0,0.9364414274734453
Negative Regulation Of Catalytic Activity (GO:0043086),26,0.7922213958415039,-0.050796008001704994,-0.050796008001705,246259.0,0.9364414274734453
L-amino Acid Transport (GO:0015807),26,0.7922213958415039,-0.050796008001704994,-0.050796008001705,246259.0,0.9364414274734453
Spindle Assembly Checkpoint Signaling (GO:0071173),26,0.7922213958415039,-0.050796008001704994,-0.050796008001705,246259.0,0.9364414274734453
Phospholipid Biosynthetic Process (GO:0008654),26,0.7922213958415039,-0.050796008001704994,-0.050796008001705,246259.0,0.9364414274734453
Regulation Of Epidermal Growth Factor-Activated Receptor Activity (GO:0007176),26,0.7922213958415039,-0.050796008001704994,-0.050796008001705,246259.0,0.9364414274734453
Regulation Of Vascular Endothelial Growth Factor Production (GO:0010574),26,0.7922213958415039,-0.050796008001704994,-0.050796008001705,246259.0,0.9364414274734453
Negative Regulation Of Receptor-Mediated Endocytosis (GO:0048261),26,0.7922213958415039,-0.050796008001704994,-0.050796008001705,246259.0,0.9364414274734453
Fatty Acid Derivative Biosynthetic Process (GO:1901570),26,0.7922213958415039,-0.050796008001704994,-0.050796008001705,246259.0,0.9364414274734453
Regulation Of Keratinocyte Differentiation (GO:0045616),26,0.7922213958415039,-0.050796008001704994,-0.050796008001705,246259.0,0.9364414274734453
Establishment Or Maintenance Of Apical/Basal Cell Polarity (GO:0035088),26,0.7922213958415039,-0.050796008001704994,-0.050796008001705,246259.0,0.9364414274734453
Calcium-Ion Regulated Exocytosis (GO:0017156),26,0.7922213958415039,-0.050796008001704994,-0.050796008001705,246259.0,0.9364414274734453
Histone H3-K4 Methylation (GO:0051568),26,0.7922213958415039,-0.050796008001704994,-0.050796008001705,246259.0,0.9364414274734453
Regulation Of Arp2/3 Complex-Mediated Actin Nucleation (GO:0034315),26,0.7922213958415039,-0.050796008001704994,-0.050796008001705,246259.0,0.9364414274734453
Negative Regulation Of Endothelial Cell Apoptotic Process (GO:2000352),26,0.7922213958415039,-0.050796008001704994,-0.050796008001705,246259.0,0.9364414274734453
Protein Export From Nucleus (GO:0006611),26,0.7922213958415039,-0.050796008001704994,-0.050796008001705,246259.0,0.9364414274734453
Phosphorylation (GO:0016310),427,0.794096851719606,-0.04289663604888145,-0.050796008001705,4036451.0,0.9364414274734453
Negative Regulation Of Protein Kinase Activity (GO:0006469),88,0.7941035068578015,-0.05033764744936924,-0.050796008001705,840389.0,0.9364414274734453
Actin Filament Organization (GO:0007015),144,0.7942463322395275,0.3134122045528704,-0.050796008001705,1375315.0,0.9364414274734453
rRNA Metabolic Process (GO:0016072),90,0.794644299603045,0.10992915577642604,-0.050796008001705,859505.0,0.9364414274734453
Positive Regulation Of Proteasomal Protein Catabolic Process (GO:1901800),90,0.7947237015061446,0.0609296484237371,-0.050796008001705,859501.0,0.9364414274734453
Regulation Of Actin Cytoskeleton Organization (GO:0032956),90,0.7947237015061446,0.06092964842373708,-0.050796008001705,859501.0,0.9364414274734453
ERAD Pathway (GO:0036503),89,0.7953394305070884,-0.04765387743258266,-0.050796008001705,849899.0,0.9364414274734453
Sodium Ion Transport (GO:0006814),89,0.7958570452717886,-0.04873556236764485,-0.050796008001705,849873.0,0.9364414274734453
Positive Regulation Of Protein Kinase Activity (GO:0045860),144,0.7960354771306164,0.028852921704697405,-0.050796008001705,1375201.0,0.9364414274734453
Positive Regulation Of MAP Kinase Activity (GO:0043406),90,0.7966041309805875,-0.036206189578354045,-0.050796008001705,859406.0,0.9364414274734453
Negative Regulation Of Actin Filament Bundle Assembly (GO:0032232),27,0.7966404600292616,-0.050796008001704994,-0.050796008001705,255717.0,0.9364414274734453
Positive Regulation Of Filopodium Assembly (GO:0051491),27,0.7966404600292616,-0.050796008001704994,-0.050796008001705,255717.0,0.9364414274734453
Cell Surface Receptor Signaling Pathway Involved In Cell-Cell Signaling (GO:1905114),27,0.7966404600292616,-0.050796008001704994,-0.050796008001705,255717.0,0.9364414274734453
Regulation Of Insulin Secretion Involved In Cellular Response To Glucose Stimulus (GO:0061178),27,0.7966404600292616,-0.050796008001704994,-0.050796008001705,255717.0,0.9364414274734453
Monoubiquitinated Histone H2A Deubiquitination (GO:0035522),27,0.7966404600292616,-0.050796008001704994,-0.050796008001705,255717.0,0.9364414274734453
Positive Regulation Of TORC1 Signaling (GO:1904263),27,0.7966404600292616,-0.050796008001704994,-0.050796008001705,255717.0,0.9364414274734453
T Cell Activation Involved In Immune Response (GO:0002286),27,0.7966404600292616,-0.050796008001704994,-0.050796008001705,255717.0,0.9364414274734453
Monoubiquitinated Histone Deubiquitination (GO:0035521),27,0.7966404600292616,-0.050796008001704994,-0.050796008001705,255717.0,0.9364414274734453
RNA-mediated Gene Silencing (GO:0031047),27,0.7966404600292616,-0.050796008001704994,-0.050796008001705,255717.0,0.9364414274734453
Regulation Of Immunoglobulin Production (GO:0002637),27,0.7966404600292616,-0.050796008001704994,-0.050796008001705,255717.0,0.9364414274734453
Myeloid Cell Development (GO:0061515),27,0.7966404600292616,-0.050796008001704994,-0.050796008001705,255717.0,0.9364414274734453
Peptidyl-Proline Modification (GO:0018208),27,0.7966404600292616,-0.050796008001704994,-0.050796008001705,255717.0,0.9364414274734453
Negative Regulation Of NIK/NF-kappaB Signaling (GO:1901223),27,0.7966404600292616,-0.050796008001704994,-0.050796008001705,255717.0,0.9364414274734453
Regulation Of SMAD Protein Signal Transduction (GO:0060390),27,0.7966404600292616,-0.050796008001704994,-0.050796008001705,255717.0,0.9364414274734453
Positive Regulation Of Cytosolic Calcium Ion Concentration Involved In Phospholipase C-activating G Protein-Coupled Signaling Pathway (GO:0051482),27,0.7966404600292616,-0.050796008001704994,-0.050796008001705,255717.0,0.9364414274734453
Regulation Of Nitric-Oxide Synthase Activity (GO:0050999),27,0.7966404600292616,-0.050796008001704994,-0.050796008001705,255717.0,0.9364414274734453
In Utero Embryonic Development (GO:0001701),27,0.7966404600292616,-0.050796008001704994,-0.050796008001705,255717.0,0.9364414274734453
Regulation Of Peptidase Activity (GO:0052547),27,0.7966404600292616,-0.050796008001704994,-0.050796008001705,255717.0,0.9364414274734453
Cortical Cytoskeleton Organization (GO:0030865),27,0.7966404600292616,-0.050796008001704994,-0.050796008001705,255717.0,0.9364414274734453
Positive Regulation Of Ubiquitin-Protein Transferase Activity (GO:0051443),27,0.7966404600292616,-0.050796008001704994,-0.050796008001705,255717.0,0.9364414274734453
GPI Anchor Metabolic Process (GO:0006505),27,0.7966404600292616,-0.050796008001704994,-0.050796008001705,255717.0,0.9364414274734453
Regulation Of Sodium Ion Transmembrane Transport (GO:1902305),27,0.7966404600292616,-0.050796008001704994,-0.050796008001705,255717.0,0.9364414274734453
DNA Synthesis Involved In DNA Repair (GO:0000731),27,0.7966404600292616,-0.050796008001704994,-0.050796008001705,255717.0,0.9364414274734453
Negative Regulation Of Cellular Response To Insulin Stimulus (GO:1900077),27,0.7966404600292616,-0.050796008001704994,-0.050796008001705,255717.0,0.9364414274734453
Regulation Of Catecholamine Secretion (GO:0050433),27,0.7966404600292616,-0.050796008001704994,-0.050796008001705,255717.0,0.9364414274734453
Iron-Sulfur Cluster Assembly (GO:0016226),27,0.7966404600292616,-0.050796008001704994,-0.050796008001705,255717.0,0.9364414274734453
Regulation Of Transcription Regulatory Region DNA Binding (GO:2000677),27,0.7966404600292616,-0.050796008001704994,-0.050796008001705,255717.0,0.9364414274734453
Amino Acid Import Across Plasma Membrane (GO:0089718),27,0.7966404600292616,-0.050796008001704994,-0.050796008001705,255717.0,0.9364414274734453
mRNA Modification (GO:0016556),27,0.7966404600292616,-0.050796008001704994,-0.050796008001705,255717.0,0.9364414274734453
Peptide Cross-Linking (GO:0018149),27,0.7966404600292616,-0.050796008001704994,-0.050796008001705,255717.0,0.9364414274734453
Ventricular Septum Morphogenesis (GO:0060412),27,0.7966404600292616,-0.050796008001704994,-0.050796008001705,255717.0,0.9364414274734453
Regulation Of Extrinsic Apoptotic Signaling Pathway In Absence Of Ligand (GO:2001239),27,0.7966404600292616,-0.050796008001704994,-0.050796008001705,255717.0,0.9364414274734453
Protein Quality Control For Misfolded Or Incompletely Synthesized Proteins (GO:0006515),27,0.7966404600292616,-0.050796008001704994,-0.050796008001705,255717.0,0.9364414274734453
Respiratory Tube Development (GO:0030323),27,0.7966404600292616,-0.050796008001704994,-0.050796008001705,255717.0,0.9364414274734453
Activation Of Phospholipase C Activity (GO:0007202),27,0.7966404600292616,-0.050796008001704994,-0.050796008001705,255717.0,0.9364414274734453
Metallo-Sulfur Cluster Assembly (GO:0031163),27,0.7966404600292616,-0.050796008001704994,-0.050796008001705,255717.0,0.9364414274734453
DNA Metabolic Process (GO:0006259),288,0.7976212963891284,-0.048709114272466186,-0.050796008001705,2738374.0,0.9364414274734453
Protein Glycosylation (GO:0006486),143,0.7977933796302235,-0.043134627965228343,-0.050796008001705,1365558.0,0.9364414274734453
Lymphocyte Differentiation (GO:0030098),91,0.798775592507772,-0.0031703458450959097,-0.050796008001705,868865.0,0.9364414274734453
DNA Damage Response (GO:0006974),383,0.7991466144052125,-0.04734511749002603,-0.050796008001705,3627119.0,0.9364414274734453
Mitochondrial Respiratory Chain Complex Assembly (GO:0033108),90,0.800763225213513,-0.0502552152143471,-0.050796008001705,859194.0,0.9364414274734453
Regulation Of Glucose Metabolic Process (GO:0010906),28,0.8009237444640869,-0.05079600800170499,-0.050796008001705,265174.0,0.9364414274734453
Regulation Of Lipid Biosynthetic Process (GO:0046890),28,0.8009237444640869,-0.05079600800170499,-0.050796008001705,265174.0,0.9364414274734453
Golgi To Plasma Membrane Protein Transport (GO:0043001),28,0.8009237444640869,-0.05079600800170499,-0.050796008001705,265174.0,0.9364414274734453
Primary Neural Tube Formation (GO:0014020),28,0.8009237444640869,-0.05079600800170499,-0.050796008001705,265174.0,0.9364414274734453
Vesicle Coating (GO:0006901),28,0.8009237444640869,-0.05079600800170499,-0.050796008001705,265174.0,0.9364414274734453
Regulation Of Protein Localization To Membrane (GO:1905475),28,0.8009237444640869,-0.05079600800170499,-0.050796008001705,265174.0,0.9364414274734453
Regulation Of Protein Targeting To Membrane (GO:0090313),28,0.8009237444640869,-0.05079600800170499,-0.050796008001705,265174.0,0.9364414274734453
Regulation Of Protein Transport (GO:0051223),28,0.8009237444640869,-0.05079600800170499,-0.050796008001705,265174.0,0.9364414274734453
Immunoglobulin Mediated Immune Response (GO:0016064),28,0.8009237444640869,-0.05079600800170499,-0.050796008001705,265174.0,0.9364414274734453
DNA Geometric Change (GO:0032392),28,0.8009237444640869,-0.05079600800170499,-0.050796008001705,265174.0,0.9364414274734453
Negative Regulation Of Wound Healing (GO:0061045),28,0.8009237444640869,-0.05079600800170499,-0.050796008001705,265174.0,0.9364414274734453
Cellular Response To Osmotic Stress (GO:0071470),28,0.8009237444640869,-0.05079600800170499,-0.050796008001705,265174.0,0.9364414274734453
Negative Regulation Of Type II Interferon Production (GO:0032689),28,0.8009237444640869,-0.05079600800170499,-0.050796008001705,265174.0,0.9364414274734453
Apoptotic Cell Clearance (GO:0043277),28,0.8009237444640869,-0.05079600800170499,-0.050796008001705,265174.0,0.9364414274734453
Positive Regulation Of Protein Import Into Nucleus (GO:0042307),28,0.8009237444640869,-0.05079600800170499,-0.050796008001705,265174.0,0.9364414274734453
"Nuclear-Transcribed mRNA Catabolic Process, Nonsense-Mediated Decay (GO:0000184)",28,0.8009237444640869,-0.05079600800170499,-0.050796008001705,265174.0,0.9364414274734453
Sterol Biosynthetic Process (GO:0016126),28,0.8009237444640869,-0.05079600800170499,-0.050796008001705,265174.0,0.9364414274734453
Membrane Fusion (GO:0061025),28,0.8009237444640869,-0.05079600800170499,-0.050796008001705,265174.0,0.9364414274734453
Transcription Elongation By RNA Polymerase II (GO:0006368),28,0.8009237444640869,-0.05079600800170499,-0.050796008001705,265174.0,0.9364414274734453
Transcription By RNA Polymerase III (GO:0006383),28,0.8009237444640869,-0.05079600800170499,-0.050796008001705,265174.0,0.9364414274734453
Positive Regulation Of Defense Response To Virus By Host (GO:0002230),28,0.8009237444640869,-0.05079600800170499,-0.050796008001705,265174.0,0.9364414274734453
Mucosal Immune Response (GO:0002385),28,0.8009237444640869,-0.05079600800170499,-0.050796008001705,265174.0,0.9364414274734453
Regulation Of Spindle Assembly (GO:0090169),28,0.8009237444640869,-0.05079600800170499,-0.050796008001705,265174.0,0.9364414274734453
Negative Regulation Of Mitotic Metaphase/Anaphase Transition (GO:0045841),28,0.8009237444640869,-0.05079600800170499,-0.050796008001705,265174.0,0.9364414274734453
RNA Phosphodiester Bond Hydrolysis (GO:0090501),28,0.8009237444640869,-0.05079600800170499,-0.050796008001705,265174.0,0.9364414274734453
Regulation Of Monoatomic Ion Transport (GO:0043269),28,0.8009237444640869,-0.05079600800170499,-0.050796008001705,265174.0,0.9364414274734453
Regulation Of Plasma Membrane Bounded Cell Projection Organization (GO:0120035),28,0.8009237444640869,-0.05079600800170499,-0.050796008001705,265174.0,0.9364414274734453
Regulation Of Calcium Ion-Dependent Exocytosis (GO:0017158),28,0.8009237444640869,-0.05079600800170499,-0.050796008001705,265174.0,0.9364414274734453
Diterpenoid Metabolic Process (GO:0016101),28,0.8009237444640869,-0.05079600800170499,-0.050796008001705,265174.0,0.9364414274734453
Regulation Of Bone Resorption (GO:0045124),28,0.8009237444640869,-0.05079600800170499,-0.050796008001705,265174.0,0.9364414274734453
Negative Regulation Of Signaling (GO:0023057),28,0.8009237444640869,-0.05079600800170499,-0.050796008001705,265174.0,0.9364414274734453
"Regulation Of DNA Damage Response, Signal Transduction By P53 Class Mediator (GO:0043516)",28,0.8009237444640869,-0.05079600800170499,-0.050796008001705,265174.0,0.9364414274734453
Glycosaminoglycan Metabolic Process (GO:0030203),28,0.8009237444640869,-0.05079600800170499,-0.050796008001705,265174.0,0.9364414274734453
Establishment Of Endothelial Barrier (GO:0061028),28,0.8009237444640869,-0.05079600800170499,-0.050796008001705,265174.0,0.9364414274734453
Positive Regulation Of DNA-binding Transcription Factor Activity (GO:0051091),245,0.8024890056476881,-0.006153150738193704,-0.050796008001705,2332834.0,0.9364414274734453
Protein O-linked Glycosylation (GO:0006493),92,0.804616028640206,-0.044643711832599145,-0.050796008001705,878130.0,0.9364414274734453
Defense Response To Fungus (GO:0050832),29,0.8050781640413314,-0.05079600800170499,-0.050796008001705,274630.0,0.9364414274734453
Positive Regulation Of Neural Precursor Cell Proliferation (GO:2000179),29,0.8050781640413314,-0.05079600800170499,-0.050796008001705,274630.0,0.9364414274734453
"Maturation Of SSU-rRNA From Tricistronic rRNA Transcript (SSU-rRNA, 5.8S rRNA, LSU-rRNA) (GO:0000462)",29,0.8050781640413314,-0.05079600800170499,-0.050796008001705,274630.0,0.9364414274734453
Positive Regulation Of Microtubule Polymerization (GO:0031116),29,0.8050781640413314,-0.05079600800170499,-0.050796008001705,274630.0,0.9364414274734453
Negative Regulation Of Myeloid Leukocyte Differentiation (GO:0002762),29,0.8050781640413314,-0.05079600800170499,-0.050796008001705,274630.0,0.9364414274734453
Negative Regulation Of Interleukin-1 Production (GO:0032692),29,0.8050781640413314,-0.05079600800170499,-0.050796008001705,274630.0,0.9364414274734453
Tube Closure (GO:0060606),29,0.8050781640413314,-0.05079600800170499,-0.050796008001705,274630.0,0.9364414274734453
Response To Interferon-Beta (GO:0035456),29,0.8050781640413314,-0.05079600800170499,-0.050796008001705,274630.0,0.9364414274734453
Positive Regulation Of Endopeptidase Activity (GO:0010950),29,0.8050781640413314,-0.05079600800170499,-0.050796008001705,274630.0,0.9364414274734453
Positive Regulation Of Dephosphorylation (GO:0035306),29,0.8050781640413314,-0.05079600800170499,-0.050796008001705,274630.0,0.9364414274734453
Response To Steroid Hormone (GO:0048545),29,0.8050781640413314,-0.05079600800170499,-0.050796008001705,274630.0,0.9364414274734453
Regulation Of Centrosome Duplication (GO:0010824),29,0.8050781640413314,-0.05079600800170499,-0.050796008001705,274630.0,0.9364414274734453
Multivesicular Body Assembly (GO:0036258),29,0.8050781640413314,-0.05079600800170499,-0.050796008001705,274630.0,0.9364414274734453
Positive Regulation Of Locomotion (GO:0040017),29,0.8050781640413314,-0.05079600800170499,-0.050796008001705,274630.0,0.9364414274734453
Positive Regulation Of Interleukin-10 Production (GO:0032733),29,0.8050781640413314,-0.05079600800170499,-0.050796008001705,274630.0,0.9364414274734453
Lipid Droplet Organization (GO:0034389),29,0.8050781640413314,-0.05079600800170499,-0.050796008001705,274630.0,0.9364414274734453
Intrinsic Apoptotic Signaling Pathway In Response To Endoplasmic Reticulum Stress (GO:0070059),29,0.8050781640413314,-0.05079600800170499,-0.050796008001705,274630.0,0.9364414274734453
Regulation Of Developmental Growth (GO:0048638),29,0.8050781640413314,-0.05079600800170499,-0.050796008001705,274630.0,0.9364414274734453
Carbohydrate Derivative Biosynthetic Process (GO:1901137),29,0.8050781640413314,-0.05079600800170499,-0.050796008001705,274630.0,0.9364414274734453
Regulation Of Protein Modification By Small Protein Conjugation Or Removal (GO:1903320),29,0.8050781640413314,-0.05079600800170499,-0.050796008001705,274630.0,0.9364414274734453
Phosphatidic Acid Biosynthetic Process (GO:0006654),29,0.8050781640413314,-0.05079600800170499,-0.050796008001705,274630.0,0.9364414274734453
Protein Insertion Into ER Membrane (GO:0045048),29,0.8050781640413314,-0.05079600800170499,-0.050796008001705,274630.0,0.9364414274734453
Homologous Chromosome Pairing At Meiosis (GO:0007129),29,0.8050781640413314,-0.05079600800170499,-0.050796008001705,274630.0,0.9364414274734453
Organic Cyclic Compound Biosynthetic Process (GO:1901362),29,0.8050781640413314,-0.05079600800170499,-0.050796008001705,274630.0,0.9364414274734453
mRNA Splice Site Recognition (GO:0006376),29,0.8050781640413314,-0.05079600800170499,-0.050796008001705,274630.0,0.9364414274734453
Protein Acetylation (GO:0006473),29,0.8050781640413314,-0.05079600800170499,-0.050796008001705,274630.0,0.9364414274734453
Positive Regulation Of Viral Genome Replication (GO:0045070),29,0.8050781640413314,-0.05079600800170499,-0.050796008001705,274630.0,0.9364414274734453
Establishment Of Mitotic Spindle Orientation (GO:0000132),29,0.8050781640413314,-0.05079600800170499,-0.050796008001705,274630.0,0.9364414274734453
Innate Immune Response Activating Cell Surface Receptor Signaling Pathway (GO:0002220),29,0.8050781640413314,-0.05079600800170499,-0.050796008001705,274630.0,0.9364414274734453
Negative Regulation Of Plasma Membrane Bounded Cell Projection Assembly (GO:0120033),29,0.8050781640413314,-0.05079600800170499,-0.050796008001705,274630.0,0.9364414274734453
Negative Regulation Of Carbohydrate Metabolic Process (GO:0045912),29,0.8050781640413314,-0.05079600800170499,-0.050796008001705,274630.0,0.9364414274734453
Phospholipid Translocation (GO:0045332),29,0.8050781640413314,-0.05079600800170499,-0.050796008001705,274630.0,0.9364414274734453
Antigen Processing And Presentation Of Exogenous Peptide Antigen (GO:0002478),29,0.8050781640413314,-0.05079600800170499,-0.050796008001705,274630.0,0.9364414274734453
Regulation Of Neuron Migration (GO:2001222),29,0.8050781640413314,-0.05079600800170499,-0.050796008001705,274630.0,0.9364414274734453
Regulation Of Cell Cycle (GO:0051726),295,0.8055455630096076,0.006296594820267667,-0.050796008001705,2803429.0,0.9364414274734453
Positive Regulation Of Cellular Catabolic Process (GO:0031331),146,0.8065056585499227,-0.04627216110354798,-0.050796008001705,1393576.0,0.9364414274734453
Cellular Response To Hormone Stimulus (GO:0032870),93,0.8067216983318286,-0.03667682888233311,-0.050796008001705,887585.0,0.9364414274734453
Negative Regulation Of Response To External Stimulus (GO:0032102),146,0.8071225353963252,-0.0444083692166134,-0.050796008001705,1393535.0,0.9364414274734453
Skeletal System Development (GO:0001501),147,0.807644637482245,0.09816262656776625,-0.050796008001705,1403026.0,0.9364414274734453
Regulation Of Macrophage Derived Foam Cell Differentiation (GO:0010743),30,0.8091100737599763,-0.05079600800170499,-0.050796008001705,284085.0,0.9364414274734453
acyl-CoA Metabolic Process (GO:0006637),30,0.8091100737599763,-0.05079600800170499,-0.050796008001705,284085.0,0.9364414274734453
Regulation Of Vasculature Development (GO:1901342),30,0.8091100737599763,-0.05079600800170499,-0.050796008001705,284085.0,0.9364414274734453
GPI Anchor Biosynthetic Process (GO:0006506),30,0.8091100737599763,-0.05079600800170499,-0.050796008001705,284085.0,0.9364414274734453
Response To Estradiol (GO:0032355),30,0.8091100737599763,-0.05079600800170499,-0.050796008001705,284085.0,0.9364414274734453
Artery Morphogenesis (GO:0048844),30,0.8091100737599763,-0.05079600800170499,-0.050796008001705,284085.0,0.9364414274734453
'De Novo' Post-Translational Protein Folding (GO:0051084),30,0.8091100737599763,-0.05079600800170499,-0.050796008001705,284085.0,0.9364414274734453
Embryonic Skeletal System Morphogenesis (GO:0048704),30,0.8091100737599763,-0.05079600800170499,-0.050796008001705,284085.0,0.9364414274734453
Organic Cation Transport (GO:0015695),30,0.8091100737599763,-0.05079600800170499,-0.050796008001705,284085.0,0.9364414274734453
Protein Palmitoylation (GO:0018345),30,0.8091100737599763,-0.05079600800170499,-0.050796008001705,284085.0,0.9364414274734453
Positive Regulation Of JUN Kinase Activity (GO:0043507),30,0.8091100737599763,-0.05079600800170499,-0.050796008001705,284085.0,0.9364414274734453
Regulation Of Dendritic Spine Morphogenesis (GO:0061001),30,0.8091100737599763,-0.05079600800170499,-0.050796008001705,284085.0,0.9364414274734453
Nucleic Acid Metabolic Process (GO:0090304),30,0.8091100737599763,-0.05079600800170499,-0.050796008001705,284085.0,0.9364414274734453
Multivesicular Body Organization (GO:0036257),30,0.8091100737599763,-0.05079600800170499,-0.050796008001705,284085.0,0.9364414274734453
Negative Regulation Of Axon Extension (GO:0030517),30,0.8091100737599763,-0.05079600800170499,-0.050796008001705,284085.0,0.9364414274734453
"Phagocytosis, Engulfment (GO:0006911)",30,0.8091100737599763,-0.05079600800170499,-0.050796008001705,284085.0,0.9364414274734453
Negative Regulation Of Peptidyl-Tyrosine Phosphorylation (GO:0050732),30,0.8091100737599763,-0.05079600800170499,-0.050796008001705,284085.0,0.9364414274734453
