Pathway,n_genes,p_val,mean_score,median_score,stat,FDR
Regulation Of Smooth Muscle Contraction (GO:0006940),20,2.4840716136295183e-21,0.880377780634276,-0.050796008001705,257985.0,6.7492225742314014e-18
Regulation Of Muscle Contraction (GO:0006937),29,9.090937337142107e-11,1.4671327342451594,-0.050796008001705,333567.0,1.2350038372507553e-07
Heart Process (GO:0003015),16,1.0345393186281012e-05,3.674605217937809,-0.050796008001705,181254.0,0.006712230113485754
Regulation Of Cardiac Muscle Contraction By Regulation Of The Release Of Sequestered Calcium Ion (GO:0010881),16,1.1385818997713491e-05,0.2400742844887195,-0.050796008001705,181124.0,0.006712230113485754
Reticulophagy (GO:0061709),16,1.235228213744158e-05,0.07673415320129193,-0.050796008001705,181013.0,0.006712230113485754
Regulation Of Adenylate Cyclase Activity (GO:0045761),17,2.4909221840519416e-05,0.16498270159445383,-0.050796008001705,190503.0,0.011076350331935
"Regulation Of Synaptic Transmission, Glutamatergic (GO:0051966)",55,2.853678775250092e-05,-0.0021045582983934266,-0.050796008001705,578532.0,0.011076350331935
Response To Ethanol (GO:0045471),18,5.5985705551189176e-05,0.10264489446654936,-0.050796008001705,199703.0,0.017034458877334388
3'-UTR-mediated mRNA Stabilization (GO:0070935),18,5.928895476213162e-05,-0.02505358070754453,-0.050796008001705,199613.0,0.017034458877334388
Positive Regulation Of DNA Replication (GO:0045740),18,6.26958368690997e-05,-0.026954138448828144,-0.050796008001705,199525.0,0.017034458877334388
Gastrulation (GO:0007369),19,9.56703439784202e-05,0.05592100130661143,-0.050796008001705,209213.0,0.02363057496266979
Regulation Of Cardiac Muscle Contraction By Calcium Ion Signaling (GO:0010882),20,0.00013304939201302064,0.18190022599063455,-0.050796008001705,218990.0,0.030124599841614755
Skeletal Muscle Organ Development (GO:0060538),34,0.00019989992777795133,0.1689976224485436,-0.050796008001705,361325.0,0.04177908490559183
Acetylcholine Receptor Signaling Pathway (GO:0095500),21,0.00022037699179168374,0.12280663866135925,-0.050796008001705,228390.0,0.04276887762128605
Positive Regulation Of Translational Initiation (GO:0045948),21,0.00025956111288492266,-0.016062204757883326,-0.050796008001705,228087.0,0.04701516958055566
Regulation Of Release Of Sequestered Calcium Ion Into Cytosol By Sarcoplasmic Reticulum (GO:0010880),22,0.00032640434748990374,0.16074602290042186,-0.050796008001705,237917.0,0.05542753825812928
Positive Regulation Of Bone Mineralization (GO:0030501),38,0.0006695933054052649,0.010999997843747772,-0.050796008001705,398765.0,0.10231038718293939
ATP Biosynthetic Process (GO:0006754),24,0.0006778016081313614,0.397073511408184,-0.050796008001705,256880.0,0.10231038718293939
Neuron Migration (GO:0001764),55,0.0007196535207653838,0.01641831617467822,-0.050796008001705,569139.0,0.1029104534694499
Negative Regulation Of Neuron Apoptotic Process (GO:0043524),74,0.0009061782317508645,0.124005766625804,-0.050796008001705,757526.0,0.12307277647652941
Regulation Of Plasma Membrane Bounded Cell Projection Assembly (GO:0120032),75,0.0009512433956595942,0.17988102704327458,-0.050796008001705,767262.0,0.12307277647652941
Regulation Of Heart Rate By Cardiac Conduction (GO:0086091),40,0.001064944396921098,0.30995223509660447,-0.050796008001705,417614.0,0.13135009997668715
"Chemical Synaptic Transmission, Postsynaptic (GO:0099565)",25,0.001145304385879463,0.0076423722509444255,-0.050796008001705,265904.0,0.13135009997668715
Heart Contraction (GO:0060047),41,0.00116025115916102,1.411982587831393,-0.050796008001705,427415.0,0.13135009997668715
Positive Regulation Of Ossification (GO:0045778),41,0.0012922009429975597,0.00647833887944635,-0.050796008001705,427100.0,0.1404363984849748
Calcium Ion Transmembrane Transport (GO:0070588),80,0.0016132477594805992,0.20909201637133817,-0.050796008001705,814673.0,0.16858439086572263
Positive Regulation Of Biomineral Tissue Development (GO:0070169),43,0.001903020806070584,0.0038144157686951243,-0.050796008001705,445985.0,0.1859333869141481
Clathrin-Dependent Endocytosis (GO:0072583),27,0.0019746016661560672,0.05894621124172906,-0.050796008001705,284891.0,0.1859333869141481
Membrane Repolarization During Action Potential (GO:0086011),14,0.0019845668827789087,0.9197234655996358,-0.050796008001705,152375.0,0.1859333869141481
Regulation Of Cardiac Muscle Cell Action Potential (GO:0098901),28,0.0024586740043039588,-0.002600957804188671,-0.050796008001705,294446.0,0.21835425623326002
Positive Regulation Of Calcium Ion Transport (GO:0051928),28,0.002491344108660677,0.06763841733973767,-0.050796008001705,294412.0,0.21835425623326002
Alpha-Amino Acid Catabolic Process (GO:1901606),29,0.00265434868076353,0.43012480094171157,-0.050796008001705,304340.0,0.2210596620154934
Cardiac Conduction (GO:0061337),45,0.002741904143677814,0.2698690969745702,-0.050796008001705,464824.0,0.2210596620154934
Regulation Of Neuron Apoptotic Process (GO:0043523),105,0.0027879066148422406,0.07985439460789139,-0.050796008001705,1058592.0,0.2210596620154934
Regulation Of Amyloid Fibril Formation (GO:1905906),15,0.0028476585095849353,0.7565818727351468,-0.050796008001705,161980.0,0.2210596620154934
Calcium-Mediated Signaling (GO:0019722),85,0.0030307755938770867,0.10080315938390766,-0.050796008001705,861313.0,0.22873936912677903
Regulation Of Voltage-Gated Calcium Channel Activity (GO:1901385),29,0.0031235722070213,0.21645646873335206,-0.050796008001705,303907.0,0.22937150503991546
Response To Alcohol (GO:0097305),29,0.0032820021379401597,0.04444317284065979,-0.050796008001705,303774.0,0.23205504248571773
Negative Regulation Of Immune Effector Process (GO:0002698),15,0.0033309336241969054,0.05583326393672466,-0.050796008001705,161678.0,0.23205504248571773
Negative Regulation Of Calcium Ion Transmembrane Transporter Activity (GO:1901020),30,0.0034653598667559755,0.5162339087486146,-0.050796008001705,313699.0,0.23538456894939963
Lysosomal Lumen Acidification (GO:0007042),16,0.004268095633575436,0.3582109597924519,-0.050796008001705,171406.0,0.273126452280473
Negative Regulation Of Neuron Death (GO:1901215),88,0.004359475609571221,0.09619639338960934,-0.050796008001705,889175.0,0.273126452280473
Response To UV-B (GO:0010224),16,0.004368716963223846,0.20208180901175143,-0.050796008001705,171358.0,0.273126452280473
Cellular Response To Alkaloid (GO:0071312),16,0.004458493890380513,0.36793820688876183,-0.050796008001705,171316.0,0.273126452280473
Cell Surface Toll-Like Receptor Signaling Pathway (GO:0140895),16,0.004523625451829697,0.14497300783536246,-0.050796008001705,171286.0,0.273126452280473
Positive Regulation Of Positive Chemotaxis (GO:0050927),16,0.004669913842975394,0.09210580763686625,-0.050796008001705,171220.0,0.2758294763340031
Activation Of Cysteine-Type Endopeptidase Activity (GO:0097202),16,0.004972833343786022,-0.017793290807274414,-0.050796008001705,171089.0,0.2874720892567366
Membrane Depolarization During Cardiac Muscle Cell Action Potential (GO:0086012),16,0.005198384161911948,0.00830337672825748,-0.050796008001705,170996.0,0.29425020349822417
Proteoglycan Biosynthetic Process (GO:0030166),32,0.005651383216136519,0.00862769331441239,-0.050796008001705,332393.0,0.3133634326172025
Cellular Response To Vascular Endothelial Growth Factor Stimulus (GO:0035924),32,0.005912907496800919,0.02916716187908109,-0.050796008001705,332257.0,0.3160620486599008
Negative Regulation Of Vascular Associated Smooth Muscle Cell Proliferation (GO:1904706),17,0.005932706839033838,0.9017225202204628,-0.050796008001705,180894.0,0.3160620486599008
Regulation Of Cell Development (GO:0060284),51,0.006476739794104334,0.006040497508456305,-0.050796008001705,521553.0,0.33840965424195146
G Protein-Coupled Acetylcholine Receptor Signaling Pathway (GO:0007213),17,0.006669211649002341,0.009297386618828639,-0.050796008001705,180635.0,0.3418914726479125
Microtubule Depolymerization (GO:0007019),17,0.006946546636667027,0.07173162130782715,-0.050796008001705,180544.0,0.34951420762637614
Positive Regulation Of Neuron Death (GO:1901216),34,0.0075774277998773435,0.31298162575028604,-0.050796008001705,351523.0,0.37108469722955895
Cellular Response To Ionizing Radiation (GO:0071479),52,0.007648414812239714,-0.018864220947761707,-0.050796008001705,530837.0,0.37108469722955895
Peptide Metabolic Process (GO:0006518),52,0.008005399241990294,0.05480526474723164,-0.050796008001705,530656.0,0.3815906972015373
Renal Absorption (GO:0070293),17,0.008210510586926125,-0.05048384246287589,-0.050796008001705,180166.0,0.3846199528392807
DNA Damage Checkpoint Signaling (GO:0000077),34,0.008565973770569823,-0.015183663643852818,-0.050796008001705,351128.0,0.3912732596694331
Positive Regulation Of G Protein-Coupled Receptor Signaling Pathway (GO:0045745),18,0.00888355155761845,0.14351459274372447,-0.050796008001705,190122.0,0.3912732596694331
Positive Regulation Of NLRP3 Inflammasome Complex Assembly (GO:1900227),18,0.008924816715080972,0.0015081595824295673,-0.050796008001705,190111.0,0.3912732596694331
Excitatory Postsynaptic Potential (GO:0060079),18,0.008928576407620483,0.03020532440573505,-0.050796008001705,190110.0,0.3912732596694331
Regulation Of Vascular Endothelial Cell Proliferation (GO:1905562),18,0.009335056797649639,0.023100485580750223,-0.050796008001705,190004.0,0.4024855807315772
Regulation Of DNA Damage Checkpoint (GO:2000001),18,0.009480705618999241,-0.020077962714895013,-0.050796008001705,189967.0,0.4024855807315772
Organelle Disassembly (GO:1903008),54,0.009667529128621578,-0.012181777057259681,-0.050796008001705,549727.0,0.40410271757638194
Regulation Of Postsynaptic Membrane Potential (GO:0060078),35,0.01049371462543744,-0.009054307821241125,-0.050796008001705,360449.0,0.4240704151770179
Regulation Of Granulocyte Chemotaxis (GO:0071622),19,0.010521924120162333,0.2791348968381559,-0.050796008001705,199829.0,0.4240704151770179
Muscle Tissue Development (GO:0060537),36,0.010613466408552527,0.1320018781452568,-0.050796008001705,370393.0,0.4240704151770179
RNA Destabilization (GO:0050779),19,0.011510741715891963,0.012947388950287471,-0.050796008001705,199604.0,0.45325630785620963
Striated Muscle Contraction (GO:0006941),57,0.011809865442059635,0.6130997529419671,-0.050796008001705,578584.0,0.45369709049869267
Calcium Ion Import Across Plasma Membrane (GO:0098703),37,0.011952119553955204,0.4176240132569787,-0.050796008001705,379954.0,0.45369709049869267
Regulation Of Calcium Ion Transport (GO:0051924),56,0.012022889405927814,0.0203951055100948,-0.050796008001705,568610.0,0.45369709049869267
Negative Regulation Of Smooth Muscle Cell Proliferation (GO:0048662),37,0.012444583329680988,0.3981257950222288,-0.050796008001705,379811.0,0.4631771631060719
Microglial Cell Activation (GO:0001774),20,0.013428705255754066,0.5284779217980822,-0.050796008001705,209297.0,0.4930512456741054
Sensory Perception Of Pain (GO:0019233),20,0.013680045703197318,0.16512298842703288,-0.050796008001705,209248.0,0.4935153475780131
Positive Regulation Of Epithelial Cell Differentiation (GO:0030858),20,0.013804625107077289,0.2739844889775879,-0.050796008001705,209224.0,0.4935153475780131
Peptide Catabolic Process (GO:0043171),20,0.014339678198174593,0.22185193120251748,-0.050796008001705,209123.0,0.5057864509970535
Intracellular Monoatomic Ion Homeostasis (GO:0006873),20,0.014693384951828165,0.017583428412974417,-0.050796008001705,209058.0,0.5057864509970535
Regulation Of Bone Mineralization (GO:0030500),58,0.014706341416550325,-0.010308969689166983,-0.050796008001705,587495.0,0.5057864509970535
Positive Regulation Of Myoblast Differentiation (GO:0045663),38,0.015147639331134718,0.13805212247860044,-0.050796008001705,389059.0,0.506462180193281
Proton Motive Force-Driven ATP Synthesis (GO:0015986),59,0.01515810292640375,0.1551368487364724,-0.050796008001705,597238.0,0.506462180193281
Selective Autophagy (GO:0061912),58,0.015285203818862366,-0.015609302399456678,-0.050796008001705,587319.0,0.506462180193281
Long-Term Synaptic Potentiation (GO:0060291),20,0.01613652309443029,-0.04192052238693069,-0.050796008001705,208806.0,0.5282281114164711
Positive Regulation Of Vacuole Organization (GO:0044090),21,0.01749041027369103,0.06418620184045472,-0.050796008001705,218644.0,0.5657314846859348
Positive Regulation Of Monoatomic Ion Transport (GO:0043270),39,0.017919084776941534,0.03423383583317693,-0.050796008001705,398373.0,0.5690753229447618
Internal Peptidyl-Lysine Acetylation (GO:0018393),39,0.018012689647865114,0.02715563999004935,-0.050796008001705,398353.0,0.5690753229447618
Regulation Of Cytosolic Calcium Ion Concentration (GO:0051480),40,0.01822313332933752,0.38505038391953356,-0.050796008001705,408246.0,0.5691063592621844
Regulation Of Cardiac Conduction (GO:1903779),21,0.018907871612349976,-0.014113043499001792,-0.050796008001705,218424.0,0.5826822135164589
Determination Of Heart Left/Right Asymmetry (GO:0061371),40,0.019086756350005462,0.0344176141897201,-0.050796008001705,408065.0,0.5826822135164589
Stem Cell Differentiation (GO:0048863),40,0.019504186126478983,0.007903783438718587,-0.050796008001705,407980.0,0.5888097078404821
Skeletal Muscle Tissue Development (GO:0007519),41,0.0209539243513121,0.10970945300538343,-0.050796008001705,417623.0,0.6230517277497215
Negative Regulation Of Protein Localization To Nucleus (GO:1900181),22,0.02117498434416378,0.0929037740401589,-0.050796008001705,228135.0,0.6230517277497215
Anterograde Trans-Synaptic Signaling (GO:0098916),188,0.021326393331146155,-0.03542922325865091,-0.050796008001705,1852683.0,0.6230517277497215
Cellular Response To Interleukin-6 (GO:0071354),22,0.021916226466753064,0.6973208154641787,-0.050796008001705,228033.0,0.6334722054273199
Regulation Of Intracellular Steroid Hormone Receptor Signaling Pathway (GO:0033143),22,0.022332418834013316,0.0017506142832291322,-0.050796008001705,227977.0,0.6387071786527808
Calcium Ion Transport (GO:0006816),112,0.02333734729584745,0.1282511930030952,-0.050796008001705,1114814.0,0.6604955479460157
"Positive Regulation Of Synaptic Transmission, Glutamatergic (GO:0051968)",22,0.02422445101775318,-0.04272738471554654,-0.050796008001705,227733.0,0.6785343651055193
Regulation Of Lysosomal Lumen pH (GO:0035751),23,0.02493792701247297,0.23373057828988236,-0.050796008001705,237661.0,0.6859834974022829
Regulation Of Translational Initiation (GO:0006446),64,0.025427842529586034,0.05877778780793194,-0.050796008001705,644023.0,0.6859834974022829
Negative Regulation Of Ion Transmembrane Transporter Activity (GO:0032413),23,0.025522409130777374,0.5434849798655306,-0.050796008001705,237589.0,0.6859834974022829
DNA Integrity Checkpoint Signaling (GO:0031570),42,0.025700073453574997,-0.021966967331062764,-0.050796008001705,426700.0,0.6859834974022829
Positive Regulation Of Neuron Apoptotic Process (GO:0043525),23,0.02575278495952626,0.0497748819668997,-0.050796008001705,237561.0,0.6859834974022829
Stress Granule Assembly (GO:0034063),23,0.02842167564443128,-0.035187281184915264,-0.050796008001705,237251.0,0.7497251720963086
Zymogen Activation (GO:0031638),44,0.030615540371549677,0.12278287000539545,-0.050796008001705,445749.0,0.792951228992726
Regulation Of Ryanodine-Sensitive Calcium-Release Channel Activity (GO:0060314),24,0.030644048231224227,0.10378472515196008,-0.050796008001705,247005.0,0.792951228992726
Cell Morphogenesis Involved In Differentiation (GO:0000904),24,0.03126595231218336,0.01720185308877906,-0.050796008001705,246939.0,0.8014112493603981
Positive Regulation Of Chemotaxis (GO:0050921),44,0.0320859617557518,-0.03315599994787965,-0.050796008001705,445540.0,0.8147435335549311
Regulation Of Monoatomic Ion Transmembrane Transporter Activity (GO:0032412),68,0.033578380568197036,0.1698337295341343,-0.050796008001705,681866.0,0.8396910984527507
Amyloid Fibril Formation (GO:1990000),24,0.033970582753181974,-0.0353349084599771,-0.050796008001705,246664.0,0.8396910984527507
Neuropeptide Signaling Pathway (GO:0007218),67,0.03399559103047574,-0.00564020011087375,-0.050796008001705,671971.0,0.8396910984527507
Muscle Contraction (GO:0006936),94,0.03552833645690837,0.2097897163962834,-0.050796008001705,936253.0,0.8688477925419786
Regulation Of Endothelial Cell Proliferation (GO:0001936),93,0.03667801750761763,-0.021311391808327553,-0.050796008001705,926269.0,0.8688477925419786
Regulation Of Epidermal Growth Factor Receptor Signaling Pathway (GO:0042058),45,0.036887984768833204,-0.0441609039328493,-0.050796008001705,454792.0,0.8688477925419786
Regulation Of Keratinocyte Proliferation (GO:0010837),25,0.03690130198137173,-0.010874749971358426,-0.050796008001705,256360.0,0.8688477925419786
Regulation Of Intracellular Estrogen Receptor Signaling Pathway (GO:0033146),25,0.03690130198137173,-0.004554980390962965,-0.050796008001705,256360.0,0.8688477925419786
Chemical Synaptic Transmission (GO:0007268),262,0.03709471620716582,-0.01266712306397019,-0.050796008001705,2557339.0,0.8688477925419786
Mitotic Cell Cycle Checkpoint Signaling (GO:0007093),25,0.03767602045494922,-0.023584142971802134,-0.050796008001705,256288.0,0.8744551609274237
Regulation Of Nervous System Development (GO:0051960),46,0.038167704294283046,-0.02104617619056864,-0.050796008001705,464512.0,0.8744551609274237
Regulation Of mRNA Catabolic Process (GO:0061013),46,0.03830542407153472,-0.021971629316352596,-0.050796008001705,464495.0,0.8744551609274237
Cell-Cell Adhesion Mediated By Cadherin (GO:0044331),25,0.03889634594955579,-0.0404662498219867,-0.050796008001705,256177.0,0.8744551609274237
Cell-Cell Junction Assembly (GO:0007043),70,0.03894334724778,0.035765281723517874,-0.050796008001705,700658.0,0.8744551609274237
Negative Regulation Of ERK1 And ERK2 Cascade (GO:0070373),46,0.04061558420819453,-0.042214707216474925,-0.050796008001705,464217.0,0.8760508381131504
Positive Regulation Of Adenylate Cyclase Activity (GO:0045762),26,0.04064556009941658,0.08599018027901886,-0.050796008001705,265984.0,0.8760508381131504
Modulation Of Chemical Synaptic Transmission (GO:0050804),122,0.04068082972898078,-0.01898214500763998,-0.050796008001705,1208177.0,0.8760508381131504
Regulation Of Potassium Ion Transmembrane Transporter Activity (GO:1901016),26,0.040815631125063756,0.4749140966500801,-0.050796008001705,265969.0,0.8760508381131504
Negative Regulation Of Telomere Maintenance Via Telomere Lengthening (GO:1904357),25,0.04090869349875165,-0.0472776808159247,-0.050796008001705,256000.0,0.8760508381131504
Protein Localization To Cell Surface (GO:0034394),26,0.04097488456099113,0.1064231958129129,-0.050796008001705,265955.0,0.8760508381131504
Cellular Response To Xenobiotic Stimulus (GO:0071466),26,0.04140968561491618,0.02465253583898725,-0.050796008001705,265917.0,0.8760508381131504
Regulation Of Cardiac Muscle Cell Contraction (GO:0086004),26,0.04159387490489378,0.010456513764265771,-0.050796008001705,265901.0,0.8760508381131504
Cardiac Muscle Cell Development (GO:0055013),26,0.04215042805849516,0.7920638978784859,-0.050796008001705,265853.0,0.8809439464225488
Positive Regulation Of Epithelial Cell Proliferation (GO:0050679),123,0.042506726635222564,-0.014854237631367216,-0.050796008001705,1217555.0,0.8816089791442726
Regulation Of Vasoconstriction (GO:0019229),26,0.042901857256102495,-0.015891932886999877,-0.050796008001705,265789.0,0.883063228521443
Negative Regulation Of Cell Adhesion (GO:0007162),72,0.044942970803529325,0.07395115840805747,-0.050796008001705,719423.0,0.9146835199485701
Positive Regulation Of Calcium Ion Transmembrane Transporter Activity (GO:1901021),27,0.045111369772951194,0.3359660310206227,-0.050796008001705,275554.0,0.9146835199485701
Vacuolar Acidification (GO:0007035),27,0.04577993675870698,0.1915784914318694,-0.050796008001705,275499.0,0.9213636160993101
Second-Messenger-Mediated Signaling (GO:0019932),72,0.04620525988315125,-0.024592770983254266,-0.050796008001705,719254.0,0.923085963989132
Dicarboxylic Acid Metabolic Process (GO:0043648),49,0.04675489614545383,0.056563865888370105,-0.050796008001705,493122.0,0.924608109695142
Cellular Response To Reactive Oxygen Species (GO:0034614),73,0.04696206077951034,0.1150523296671946,-0.050796008001705,728956.0,0.924608109695142
Positive Regulation Of Response To Wounding (GO:1903036),27,0.0484957861533028,0.011705371217938325,-0.050796008001705,275282.0,0.9364414274734453
Positive Regulation Of Mitotic Cell Cycle (GO:0045931),27,0.04862398109428684,0.18341320652800086,-0.050796008001705,275272.0,0.9364414274734453
"Synaptic Transmission, Glutamatergic (GO:0035249)",27,0.04879103937334334,-0.005787661030157278,-0.050796008001705,275259.0,0.9364414274734453
Cardiac Muscle Cell Differentiation (GO:0055007),27,0.04950290614947712,-0.00045514264578110135,-0.050796008001705,275204.0,0.9364414274734453
Microtubule Polymerization Or Depolymerization (GO:0031109),27,0.04996021199420437,0.026351017859852277,-0.050796008001705,275169.0,0.9364414274734453
Blood Circulation (GO:0008015),50,0.050268960543954765,1.1413323842989394,-0.050796008001705,502605.0,0.9364414274734453
Regulation Of Mitotic Metaphase/Anaphase Transition (GO:0030071),49,0.050873960128568596,-0.027343234595528766,-0.050796008001705,492691.0,0.9364414274734453
Positive Regulation Of Cell Death (GO:0010942),50,0.05137345365668636,0.17376510825468594,-0.050796008001705,502492.0,0.9364414274734453
Phospholipid Catabolic Process (GO:0009395),28,0.05222061484259979,0.13544155602173916,-0.050796008001705,284932.0,0.9364414274734453
Negative Regulation Of Cation Channel Activity (GO:2001258),28,0.05347293329208818,0.08170176327286505,-0.050796008001705,284839.0,0.9364414274734453
Protein Localization To Golgi Apparatus (GO:0034067),28,0.053500123982162494,0.03225094189758857,-0.050796008001705,284837.0,0.9364414274734453
Vascular Endothelial Growth Factor Receptor Signaling Pathway (GO:0048010),28,0.053649868650201764,0.03946373832387022,-0.050796008001705,284826.0,0.9364414274734453
Regulation Of Striated Muscle Contraction (GO:0006942),28,0.05412853860282853,0.7326494589280642,-0.050796008001705,284791.0,0.9364414274734453
Cell-Substrate Junction Assembly (GO:0007044),28,0.05456913167411431,-0.008645190001830274,-0.050796008001705,284759.0,0.9364414274734453
Regulation Of Release Of Sequestered Calcium Ion Into Cytosol (GO:0051279),51,0.05499066428245305,0.08921823393586457,-0.050796008001705,511980.0,0.9364414274734453
Negative Regulation Of G2/M Transition Of Mitotic Cell Cycle (GO:0010972),28,0.05592202351638766,-0.026499699939291733,-0.050796008001705,284662.0,0.9364414274734453
Protein Depolymerization (GO:0051261),28,0.056430808638757365,0.02359576693622523,-0.050796008001705,284626.0,0.9364414274734453
Cardiac Muscle Cell Action Potential (GO:0086001),29,0.05831968614365313,0.4404090606527935,-0.050796008001705,294414.0,0.9364414274734453
Cellular Response To Organonitrogen Compound (GO:0071417),104,0.06081676522691627,0.08180726933066998,-0.050796008001705,1029927.0,0.9364414274734453
Chondrocyte Differentiation (GO:0002062),29,0.06119121218008958,0.0039720163139199864,-0.050796008001705,294217.0,0.9364414274734453
Positive Regulation Of Endothelial Cell Proliferation (GO:0001938),77,0.06223172197605129,-0.015298598694936442,-0.050796008001705,766303.0,0.9364414274734453
Cellular Response To UV (GO:0034644),78,0.06348901694647333,0.009477292897425072,-0.050796008001705,775947.0,0.9364414274734453
mRNA Stabilization (GO:0048255),52,0.06510291487722901,-0.04188516778449562,-0.050796008001705,520896.0,0.9364414274734453
Positive Regulation Of Lipid Kinase Activity (GO:0090218),30,0.06672487107638012,0.07789089143661229,-0.050796008001705,303762.0,0.9364414274734453
Brain Development (GO:0007420),164,0.06689953142533493,0.042143406576050396,-0.050796008001705,1610556.0,0.9364414274734453
Regulation Of Blood Vessel Endothelial Cell Migration (GO:0043535),53,0.06788094677427349,-0.017589307539334693,-0.050796008001705,530490.0,0.9364414274734453
Positive Regulation Of Leukocyte Chemotaxis (GO:0002690),54,0.06941963152132681,0.04187109351373224,-0.050796008001705,540187.0,0.9364414274734453
Mitotic G2 DNA Damage Checkpoint Signaling (GO:0007095),30,0.06972780363117344,-0.028119453810119287,-0.050796008001705,303573.0,0.9364414274734453
Negative Regulation Of Epithelial To Mesenchymal Transition (GO:0010719),30,0.06993811790245816,0.0014464476904963931,-0.050796008001705,303560.0,0.9364414274734453
Regulation Of Myoblast Differentiation (GO:0045661),54,0.07077490969029937,0.08209712085480622,-0.050796008001705,540075.0,0.9364414274734453
Heart Development (GO:0007507),166,0.07086946179121034,0.10847399204150475,-0.050796008001705,1629271.0,0.9364414274734453
Extracellular Structure Organization (GO:0043062),107,0.07172862438263905,0.03548416962678888,-0.050796008001705,1057802.0,0.9364414274734453
Eye Development (GO:0001654),55,0.07256253697248628,0.1360915442376088,-0.050796008001705,549750.0,0.9364414274734453
Positive Regulation Of DNA Metabolic Process (GO:0051054),107,0.0737745935682915,-0.0404273138175989,-0.050796008001705,1057571.0,0.9364414274734453
External Encapsulating Structure Organization (GO:0045229),108,0.07480785661593034,0.03468527909319172,-0.050796008001705,1067179.0,0.9364414274734453
Positive Regulation Of Leukocyte Migration (GO:0002687),31,0.07496831091345856,0.06781217940691596,-0.050796008001705,313150.0,0.9364414274734453
Positive Regulation Of Translation (GO:0045727),108,0.0753316204069474,-0.03513499037736344,-0.050796008001705,1067121.0,0.9364414274734453
Regulation Of Long-Term Synaptic Potentiation (GO:1900271),31,0.07625378006563628,-0.01693706428421328,-0.050796008001705,313074.0,0.9364414274734453
Modulation Of Excitatory Postsynaptic Potential (GO:0098815),31,0.07719446720171301,-0.030211035175871474,-0.050796008001705,313019.0,0.9364414274734453
Calcium Ion Transmembrane Import Into Cytosol (GO:0097553),83,0.07964884464440469,0.15976400539351948,-0.050796008001705,823181.0,0.9364414274734453
